run_id,policySize,policy,len_c0,len_c1,len_c2,len_c3,len_c0_encoded,len_c1_encoded,len_c2_encoded,len_c3_encoded
422,43,and and and and and xPXoqGQ0v6ÂMéÁoVTmi xPXoqGQ0v6ÂMéÁoVTmi y8áQé1J7âKbUWuiXW6nÛac2ÇFrkãP_ y8áQé1J7âKbUWuiXW6nÛac2ÇFrkãP_ and and and HÇ9bCûRT35R bjVÛi7fDWeb_ÉnDú and úJTéÃ5MbcÁL YaÇNLH3X and and bjVÛi7fDWeb_ÉnDú ço5GGhyQVVdoRc2Û xPXoqGQ0v6ÂMéÁoVTmi and and and and and and and pgÊ0êáêyK6PÂIzGD8_I98yNKIPÃêzl xPXoqGQ0v6ÂMéÁoVTmi and KpJGnÊL BaKVéÚc1 and and and and 2AUFe1JéczG ÁçjWR3ûB xPXoqGQ0v6ÂMéÁoVTmi and çJOyq3sjêI2xGÂáJVÚGÕO rCrhdbHT rCrhdbHT and 7YGnuYeyiaûj7Ff ço5GGhyQVVdoRc2Û and xPXoqGQ0v6ÂMéÁoVTmi KpJGnÊL and and UÃtAszdYwbUjÚP2 and and rCrhdbHT HÇ9bCûRT35R ço5GGhyQVVdoRc2Û and and qIÂa80b_ÂNA F1bâõA1U and tUdqÊpisõ3Átéh and and and xPXoqGQ0v6ÂMéÁoVTmi HÇ9bCûRT35R xPXoqGQ0v6ÂMéÁoVTmi 2AUFe1JéczG and and 9wufõwé0BéLÇ and and y8áQé1J7âKbUWuiXW6nÛac2ÇFrkãP_ dRxçâsâW8Q1sÉxç pgÊ0êáêyK6PÂIzGD8_I98yNKIPÃêzl and UÃtAszdYwbUjÚP2 and y8áQé1J7âKbUWuiXW6nÛac2ÇFrkãP_ bx1ÁÂfÃBRRmYÕiHêYGSOMF_SE,122,5246,5246,5246,164,7094,7094,7094
421,43,and and and and rÂÉvuûUzÇVP8xu tnyloTAxÊXFÛuQHÃN and áÉXÂ4JTtZNÚx3COváÊÕ jjRWTM1 and yoâdy7 and and yoâdy7 and 1Y64naéA aXxÚyx0IxêauKLGALçabÉÉq1j2nÕõ and tnyloTAxÊXFÛuQHÃN and and v2pOeãfûqáE9OVzF and ÛõIUnéJTãw6bÊÊ and rÂÉvuûUzÇVP8xu o2Âq2UáEpúprqViaG_êztOPoéÉuêM 63u6XÊ8i and and and and ÚQoÁTedJzú0C78VmaãiJÛGfYaéOAZ aXxÚyx0IxêauKLGALçabÉÉq1j2nÕõ sg3ÁNqIAêDÚRKçydçâÕõ1 and and and roiULoÊÕû2_DÕ_H5 lKpaFêdYRÉF5Y and and QvbsúYVz8jQêBmêV ÃpUhu1Jb ÛõIUnéJTãw6bÊÊ yoâdy7 and and ÃpUhu1Jb and QÊIjÃrûÃÛdosSZézGRQy0Z92 and aXxÚyx0IxêauKLGALçabÉÉq1j2nÕõ tnyloTAxÊXFÛuQHÃN and and and áÉXÂ4JTtZNÚx3COváÊÕ and q4çõaûúHÕçâkzZw õGmeÁ_ÕHêêûÚ5vFÊ XnMJE5XjMjk4kWYYzÃzZ9 and and and ijyûahr7b5êB1tR õLo_ÕRkKDLlP9 ijyûahr7b5êB1tR and and ûFIpW_ÂdâWkqHQMnúâJÇúâmÉFÁ ÇéyMz and and and and and QÊIjÃrûÃÛdosSZézGRQy0Z92 q4çõaûúHÕçâkzZw yyÚ0E and 1Y64naéA sg3ÁNqIAêDÚRKçydçâÕõ1 yyÚ0E lKpaFêdYRÉF5Y,122,5246,5246,5246,164,7094,7094,7094
428,43,and and and and UmÇêZ_QmûÚCrÇyÉagÉOçã and JlUhOVâQFNrDiÇãaç_Tú UmÇêZ_QmûÚCrÇyÉagÉOçã and tOWââxt4tQpHfL and tOWââxt4tQpHfL and vxWûlo2MÉûCyÚÚYõotûBfxxMVÛADwÛ tvGw5nõv3XsrSl2vúPOmTãw and and and and and and and tvGw5nõv3XsrSl2vúPOmTãw vxWûlo2MÉûCyÚÚYõotûBfxxMVÛADwÛ ZÕVÕZ94MtrúãIb9BQV0vLZû17ã6jy and éKúSrKiiO obfOz3YáKEúbWÛtD and and bw8euAÛ1qÚ7yOK66ãMõsE8wûz8 M27ÇlhpZ0ÚútDHILâBÇao YÃaÁ7vKZ0ê_dMYÃ and and and and JlUhOVâQFNrDiÇãaç_Tú NâNjI2irgcÂ1v2âaWÚGCçy1u6çw oCIzmJ8JéoHLO34hTLvEr3wçyq9ÃÇ and vxWûlo2MÉûCyÚÚYõotûBfxxMVÛADwÛ wç2FâÁûSU7VuodWO and lSâmlvfGGçc0ÁrBhútzÂXéBõj tvGw5nõv3XsrSl2vúPOmTãw and and bw8euAÛ1qÚ7yOK66ãMõsE8wûz8 nréÇspojmUtGÚâzédmÚWOUÂ and JlUhOVâQFNrDiÇãaç_Tú and and bw8euAÛ1qÚ7yOK66ãMõsE8wûz8 hAUgdHgÉãEãE and M27ÇlhpZ0ÚútDHILâBÇao L2SUÃJdÂWintuqAKRICÕ2 and and and and ZÕVÕZ94MtrúãIb9BQV0vLZû17ã6jy oCIzmJ8JéoHLO34hTLvEr3wçyq9ÃÇ M27ÇlhpZ0ÚútDHILâBÇao RThPFxcq5ÕPâNKÊoeOBWRNhgFT1BY wç2FâÁûSU7VuodWO and and and and cÇXzÉéÚ9W wç2FâÁûSU7VuodWO BúCZvf6âPNÁ5ÚÛ ÇaÛ0hÊTKhêfI and and éKúSrKiiO and ÚlpKÁnh UmÇêZ_QmûÚCrÇyÉagÉOçã and LFÛÇÁáGDÉMtfLÃ0vKx8sÇÉgÁêF ûKFVmT,122,5246,5246,5246,164,7094,7094,7094
420,43,and and and 7ÇçqaãuÃ1vE and and and fcbÂbP0 WeqBgrAçJWnMõ 8rYdYSGé DiÛéêrâãs_Pzg3K4g and Kx2_i1olÃarÊç 7ÇçqaãuÃ1vE and and and and uTÚÛbNûUkjÇzTzZúlfus and Fi98rxY and Y5gÉÊl6CF7DKJF ÕêâIvÁ1FYY5ç8ÕÉHT uTÚÛbNûUkjÇzTzZúlfus and and and ÛSÕk2 ÛSÕk2 and and and ÕêâIvÁ1FYY5ç8ÕÉHT FOuD8LtOefÚR4AúHwúWEmOKáÉy ÊáêJ6N48c8PvOÊadNFGêCPChwLw0fÕ and âuckY7t8_ÛXJvgefÃJcã qwlâFâmújú and and uTÚÛbNûUkjÇzTzZúlfus ÕêâIvÁ1FYY5ç8ÕÉHT zR1tÚCPkúhp4vÇ1ZãLx4ttEEqÛY and and and and and and FOuD8LtOefÚR4AúHwúWEmOKáÉy aá0qa7dâêÂUrhBOÇéHyázF Y5gÉÊl6CF7DKJF Fi98rxY and 2áJF6ÊSÇX0yfHAgç3D4âL and and and and ÛSÕk2 Kx2_i1olÃarÊç DiÛéêrâãs_Pzg3K4g U2bÚwSÉçFâB_B7õ7ÃzbGWrJuEqã zR1tÚCPkúhp4vÇ1ZãLx4ttEEqÛY and and and and Fi98rxY CftVbXs nÇÛ0õéãs_ Y5gÉÊl6CF7DKJF uTÚÛbNûUkjÇzTzZúlfus and ÕêâIvÁ1FYY5ç8ÕÉHT and and and and ÛSÕk2 qDÇÁ6JSqÊPmSs _gÛiRmE7ohgXõano3õ_F4JCx uTÚÛbNûUkjÇzTzZúlfus WeqBgrAçJWnMõ,122,5246,5246,5246,164,7094,7094,7094
425,43,and and and and and r8êptUfxK Oê7hãrWâ1êtrkrfTYÇgL 4beo4hGçaÁÊçmÃãÉ1g8KtÛPFpé and and oûMêD ûPnBaçÊDymZP and nzLKW7Kvgw1ekÃõAÃkNrbPgÚ8ot89_ j3õÁW7JCâhRçzéÛmç and and and and and ÛrzEçÊâMV1ÚDzu66ÕÊêÇzêGéST and and oûMêD QkrQl9gQ and UpûJÚr and hjtmÛb8WtNc eMU8xûõFr8jááo and hÂêfváhbÚ5Dmj825nÛxdESWq3ÉB2éI Y7tâTgBL77 and áRQ5BÚC71cãGa1pÕUNofMxêqná2 and and VâõéÂq1YKéâinÁlêNrOyzhkGç eMU8xûõFr8jááo and Oê7hãrWâ1êtrkrfTYÇgL eiS5jMq9t hVçAnhÁÃOWzPbãZcn1pPûy1tûV6 and ÚiMAtq0 gtsjççpH and and 5EmXgÇ VUáF4ÇrpõhÛvtY2 and and and and and Y7tâTgBL77 and Oê7hãrWâ1êtrkrfTYÇgL 199Kã4Ú4C4W4ZÊ9ÂhgÊoynwá5ê6ho and áRQ5BÚC71cãGa1pÕUNofMxêqná2 hVçAnhÁÃOWzPbãZcn1pPûy1tûV6 and and and and ÚiMAtq0 Oê7hãrWâ1êtrkrfTYÇgL r8êptUfxK gtsjççpH lbxeyZâFÁiCIsû7Xê eiS5jMq9t and and áRQ5BÚC71cãGa1pÕUNofMxêqná2 and YORã7D9soLWêÉÇÛwDOçhqêxoûZõ5tÁ 5EmXgÇ and AÕGdk1PHPOuMwÚTqFMCÉycZmÇ and hÂêfváhbÚ5Dmj825nÛxdESWq3ÉB2éI and Oê7hãrWâ1êtrkrfTYÇgL QkrQl9gQ,122,5246,5246,5246,164,7094,7094,7094
424,43,and and and and and and and and and J16xaVÕÂ96çpHfrwNz9ÕúTÃûH3bdv and HÇD5I6 and oãBÃLJw_Yf meeÂé5O8gnRÕaI ûU6_NXõûõ and FGqê0aSõÃwgiO33BE oãBÃLJw_Yf ÊTÂúyj0éwÂBUaÊfÛW19FrÃ0h9W7iIP kV7WzVÉÂÃHXçqZYMtw8lok and and and MhûsWCarPjLaõ9IxÕDKû and PeãADad3y3gûN_bDé and okmDTu4_sVmg ÕYho3JÃâfB7_DÇBBÊsj4XfCh and Ç4DãÉVwQ and KYJj1úhCllZfeHXSgãqS7úu6WêAp FGqê0aSõÃwgiO33BE and okmDTu4_sVmg and AuPfv7CO 0dêxak and and and êM87búYÊMBlXjgWdS77Vúnlhúvw meeÂé5O8gnRÕaI and AuPfv7CO ICF21SLEaáÕN1T3 and oãBÃLJw_Yf meeÂé5O8gnRÕaI and and and and KçsOéâsoZmypqK2xU1RÂXÂ 6mHféRiõwYOéC6Ãgq_1IÛNbAÇt and êõoãÉK7KvsûûfÉLyÁYko êõoãÉK7KvsûûfÉLyÁYko and and and ûÕF8FQRz6Wxr1ÉÛEÊk oãBÃLJw_Yf ICF21SLEaáÕN1T3 and cGkv3BúSrzpsBAm5bwfNU7H and AuPfv7CO PeãADad3y3gûN_bDé NÕf0E4y9ûg and and and and and meeÂé5O8gnRÕaI ÕYho3JÃâfB7_DÇBBÊsj4XfCh meeÂé5O8gnRÕaI and Dn6hsçSID_V4LxOr5PoÊfkLNRzr êM87búYÊMBlXjgWdS77Vúnlhúvw KÁgkIkÇBI9VçÕÕH_pÇILê4Ânfa6oZê kV7WzVÉÂÃHXçqZYMtw8lok,122,5246,5246,5246,164,7094,7094,7094
426,43,and and and W9ÁjyIgçwYORlÊÛLÊãKFUNrlsY and and and áoK6rJh5WjhÉ1É5 Q8TÇO3oDd_55Kmy2Zv2eÕZF8Éw and and XYEdçÂIÕKéeCVgVcHGo9QMúúTMS and and and áoK6rJh5WjhÉ1É5 vASxKn1uTnjâoeem Ã4BváõuefuJÁHM4VÃZ_ and PgUyõcÁquts4 and ÃJhqqUãCÕ8yPõCdg7_j5lÃWFÊwr2gE õcmFiHû5J83WUIfiGÉL2GÕ2 SÚçZÂaFysQtU and and ÇbáWr3FûÉemVúD ÇbáWr3FûÉemVúD and and and and and vASxKn1uTnjâoeem ûRÕpÊ7y and sõDÂSj_LpX7wF3IzcÂoUû vASxKn1uTnjâoeem úâéKmSNõzdL8_u9xvÚ áoK6rJh5WjhÉ1É5 and sõDÂSj_LpX7wF3IzcÂoUû and and pUátlÂûgYYveÁQNwHMû2q33jOÛÕ8Lh tKTfisN_jwÁ jXâMsDLYh and and sõDÂSj_LpX7wF3IzcÂoUû and ÁÁjAcqâkNx4lû80jIDáúhlKVjL jXâMsDLYh and and and 32teDwL and rvûdÉaHeGTe0 and 3gyvP1SoajrYg3ÇkúgFÛEû OõKgÕ and úâéKmSNõzdL8_u9xvÚ and ûRÕpÊ7y and lõpFY7ÉaBéXDqAD9MlÂnk and iqÁãÕ7 32teDwL and and and and vASxKn1uTnjâoeem YFwoP1HC4 3gyvP1SoajrYg3ÇkúgFÛEû áoK6rJh5WjhÉ1É5 and pUátlÂûgYYveÁQNwHMû2q33jOÛÕ8Lh úâéKmSNõzdL8_u9xvÚ and ÁÁjAcqâkNx4lû80jIDáúhlKVjL õcmFiHû5J83WUIfiGÉL2GÕ2,122,5246,5246,5246,164,7094,7094,7094
423,43,and and and 8G_nfõ2ÛiÚ and XéiÛÃÁbÃú5ÃB_xtÛLUã4oLâÛáIOÃv QV5cBê and and and 4UcYziç0gNv0N4WbKsêMkAVtiIOt and and 4UcYziç0gNv0N4WbKsêMkAVtiIOt IÇiÊ2H1pWEBfETPiâJneGbE aõAzBxskoGEfzú0ÕF and S0FfûB gÁÚydb5ELMgHRõ_êbZwÊ4ÊÃqâvM and BlÚ46dÂhjdÛzÛdÇbeoS2BAKbBXánm and Á1kõTns6g4EJhl_Ú6C ésPM8vky5yyoiQRg_Ây4HN7u and and and and Çr_rY_v29Ã1ZsAjÃéãêhqn5ÇBHTO and m1Rd9êÉrOJOdO4YÚ and and and and 3úocÇ2tzw pai4fÉOAQânHCÇÃzÁ2rÂm and 3úocÇ2tzw and cÕXrd7çq ésPM8vky5yyoiQRg_Ây4HN7u ésPM8vky5yyoiQRg_Ây4HN7u and 4UcYziç0gNv0N4WbKsêMkAVtiIOt õjÁâ22daaáR_ÕVHBÂjÚk0XY4gOfN4h and and Çûú2QêyYdY and MNkOÚeMDaÉn 4UcYziç0gNv0N4WbKsêMkAVtiIOt and and and QV5cBê lCIÇzMJq6t and yWreegjOzutÇÂy 4UcYziç0gNv0N4WbKsêMkAVtiIOt and 4UcYziç0gNv0N4WbKsêMkAVtiIOt and and ÕeúWúâÉqiPIoÛm and IÇiÊ2H1pWEBfETPiâJneGbE m1Rd9êÉrOJOdO4YÚ 0ÁÇ6L_x and 3úocÇ2tzw and 8G_nfõ2ÛiÚ and BlÚ46dÂhjdÛzÛdÇbeoS2BAKbBXánm and lCIÇzMJq6t ésPM8vky5yyoiQRg_Ây4HN7u and and ÚKÁMjSvú2cÇ and aõAzBxskoGEfzú0ÕF L66tCÁFçDGÇ 4UcYziç0gNv0N4WbKsêMkAVtiIOt,122,5246,5246,5246,164,7094,7094,7094
429,43,and and and and and and and and q7ÊfwÊiÂrIãYYgxve5 05MûêGvAmõqYÃwazSC__çK3 fiyCGdjgCBtUãqÃêlâ and and ÉxIV34VBPpmIFqpõ2DWJÛcâkcVhsf xUÇfwajtq2P0aû_qKoÁÇ1Y6ÚrÕeGL and ÇXãMcz and oCch1éÇd5SQ0FÛûÇÊV xUÇfwajtq2P0aû_qKoÁÇ1Y6ÚrÕeGL and uBÉRPSd6s1ÂiB02NYzGÛmkâ52 ÇXãMcz oCch1éÇd5SQ0FÛûÇÊV xUÇfwajtq2P0aû_qKoÁÇ1Y6ÚrÕeGL and and áqtrgúwÕDQ7 ágFcãeDâl6a27Ú_dzXVOSÂqVAP Áp25éKH0ÂxMCGO1gzR6jwyRkÉnÂ and and and êqcFÊÊÛÛm4Ké and fiyCGdjgCBtUãqÃêlâ and SeXSPuçxÛxHãgS83aRfS1fy1ÁoP WfpIXásmáÃ2BBpÇ6ÁÕyEkaHJ and OHÁZAISêÛ 7OSSOaFXúêâBRAyLxÊJhÃiêã8tj and and and uBÉRPSd6s1ÂiB02NYzGÛmkâ52 IájyaOãYKXõÃwâIM9eúWBk and and and and 7OSSOaFXúêâBRAyLxÊJhÃiêã8tj and and and 7OSSOaFXúêâBRAyLxÊJhÃiêã8tj ÉxIV34VBPpmIFqpõ2DWJÛcâkcVhsf WfpIXásmáÃ2BBpÇ6ÁÕyEkaHJ and SeXSPuçxÛxHãgS83aRfS1fy1ÁoP xUÇfwajtq2P0aû_qKoÁÇ1Y6ÚrÕeGL and Áp25éKH0ÂxMCGO1gzR6jwyRkÉnÂ flMm7EÃJEMúFkGVzúXiTkãyrQ_WBÂâ and and 05MûêGvAmõqYÃwazSC__çK3 hjDSNEéXçÛâEjqAiéDIUO3 áqtrgúwÕDQ7 and and and roTO5zA WTEõJVFpT19ÃsçáB8 tGsrÃûx7gTâqPXyQúÊRLb flMm7EÃJEMúFkGVzúXiTkãyrQ_WBÂâ and xUÇfwajtq2P0aû_qKoÁÇ1Y6ÚrÕeGL and M5OlCÃCiK_imÃPCuXIeéX and xUÇfwajtq2P0aû_qKoÁÇ1Y6ÚrÕeGL and 05MûêGvAmõqYÃwazSC__çK3 WfpIXásmáÃ2BBpÇ6ÁÕyEkaHJ,122,5246,5246,5246,164,7094,7094,7094
427,43,and and and 5kYkMCêQVnÊVl and isfF6uJTST0sÇSJJIE ûÛhQAASW6pçéOõf65ÂçjgOÁ and ã_pxF Oyam6VfIYoúTWUaVeASP8GÁ and and and and and ÚRÊfoúcLph90ÃáRié2W ã_pxF and F1úJOif MlrpêfÛáKgÛ3zSLêúGQãL F1úJOif and and and and and and and êÛç0nÂdÚy 3ZJLK9W9LYáS and êÛç0nÂdÚy and _udE6ÕqxhGOÕR cJgXêOêÛtdÇJRcthWÛãU2é4Dg3d CESQ7éJgyÉ54ÇhiÇzzypb and and and iÕzSâCo 3QÁV3võyAjF4cyxZâNgZÚÃ and and 3ZJLK9W9LYáS nÉõXtnymPoÚékemWuK7ghGsHûÃç ÊE4WY ã_pxF and bQm6GcÁ6éaÕbB_L37qtOãICsÁyn ZCeiaPoqÚGBUçMjÂeJgDFo and and and m3ÃÕB and iÕzSâCo and F1úJOif 3QÁV3võyAjF4cyxZâNgZÚÃ and and VÉx8â7PnIEKâeZpvqÛ733 CESQ7éJgyÉ54ÇhiÇzzypb paOÊâlf Oyam6VfIYoúTWUaVeASP8GÁ and Oyam6VfIYoúTWUaVeASP8GÁ âxcÃGSNÛn0EMwbQg and êÛç0nÂdÚy and and and Ç9XXOGÊJgj_L MlrpêfÛáKgÛ3zSLêúGQãL 65sSÕÚkjÕyM_J8VJÊqKmÉsMtE and OH5OTS8lK0tUnyÚ0 and and and 3ZJLK9W9LYáS a6xjsXWlVHmÂhf3Árl06 paOÊâlf êÛç0nÂdÚy,122,5246,5246,5246,164,7094,7094,7094
434,44,and and and and and and â1ÁRrúbf7éCGX_sõÇÛqz and and bFqâOX36ÚzvQXRuDké4ivAgnxk9C and bFqâOX36ÚzvQXRuDké4ivAgnxk9C ûBYÇ4âÕDND 0qMVc7çm0WB oRsO4GvVéiQNxh and â1ÁRrúbf7éCGX_sõÇÛqz KVWBk1cB1ÛcQ9TX1âWû0bÃ and wÉvUVdGÁPhSGÚ wÉvUVdGÁPhSGÚ and and and EéFmÚlo0Y0gtûZTWÃéEau4Cáx and bFqâOX36ÚzvQXRuDké4ivAgnxk9C sÂêQ5bfTXe2J_MynQNO and bFqâOX36ÚzvQXRuDké4ivAgnxk9C KVWBk1cB1ÛcQ9TX1âWû0bÃ tãzVSâçmlçYC3ÚtO4çÕ and and and and â1ÁRrúbf7éCGX_sõÇÛqz and and and and ÊáhKMt7eÉCRBJÉeÚâitlOúxGoS ÊáhKMt7eÉCRBJÉeÚâitlOúxGoS and wÉvUVdGÁPhSGÚ DÃdgOvrQMêÚXxeYAGdâIMké9 and and bFqâOX36ÚzvQXRuDké4ivAgnxk9C R4_Ú9PM ú1U7kQF and ádrFEF5YÃhNzGEjj bFqâOX36ÚzvQXRuDké4ivAgnxk9C and oGGânmA and ûBYÇ4âÕDND zûjZragÊeÂ1YwLûjl and and and â1ÁRrúbf7éCGX_sõÇÛqz 3wCÕYÃqObwÂ_jTMHstWdZ2wgICbz4O and and wÉvUVdGÁPhSGÚ Hs0Õ22 sÂêQ5bfTXe2J_MynQNO wÉvUVdGÁPhSGÚ and and and â1ÁRrúbf7éCGX_sõÇÛqz â1ÁRrúbf7éCGX_sõÇÛqz and and ldJCo02 â1ÁRrúbf7éCGX_sõÇÛqz wÉvUVdGÁPhSGÚ and and and â1ÁRrúbf7éCGX_sõÇÛqz bFqâOX36ÚzvQXRuDké4ivAgnxk9C Hs0Õ22 Õ5aDÇK8éb43BÚ,122,5368,5368,5368,164,7259,7259,7259
438,44,and and and and and 0RÇdHnqpÁ kgãÚcÂá56Õjcb_AwH36spYã and and e1xLÃokf7WSOéÇlEçaD49y cÕAf3mGyDBQuW5béxjJXBm3JaQHHv páJTUqcEnnuBB6ê5ûÇsSõwOuxr and and FÃâOêNRáS7pWvlj1DEÉPL jqcoFççaÁHstãtN7F8f7AyAãç20kRa JâBÂ5b1 and and and and 4HLhu1NûgvãçJ_Wc42o and BÁ6A9gJ and cÕAf3mGyDBQuW5béxjJXBm3JaQHHv páJTUqcEnnuBB6ê5ûÇsSõwOuxr and and and e7hyHAhÃMyb JvUsÚngZqj ROl4MÛ and 2dNwFtÂvJ6 éGÕvZ and and and and páJTUqcEnnuBB6ê5ûÇsSõwOuxr ROl4MÛ Ê9Ã7SwÕX FÃâOêNRáS7pWvlj1DEÉPL and ÛCoGMbgÕÕqwWMÁuph_v23ã and ÛCoGMbgÕÕqwWMÁuph_v23ã and páJTUqcEnnuBB6ê5ûÇsSõwOuxr cÕAf3mGyDBQuW5béxjJXBm3JaQHHv and ETjVúcrSuBgûõuBQâ8oiJûIK and and and and and ETjVúcrSuBgûõuBQâ8oiJûIK ExRZ5âXVP9xmwéõÕxqêj ÛCoGMbgÕÕqwWMÁuph_v23ã 2dNwFtÂvJ6 ZwENinuuiHkCYÊçTÉ0M4Ûy and and and ûûdJ7 jqcoFççaÁHstãtN7F8f7AyAãç20kRa RÃwwáhêf and jqcoFççaÁHstãtN7F8f7AyAãç20kRa ROl4MÛ and and JâBÂ5b1 and ÊGÂLqG8ÂonIayLf1ÊFá5Çsõo1B and LO_s6Nm33GwéÃ ROl4MÛ and and páJTUqcEnnuBB6ê5ûÇsSõwOuxr páJTUqcEnnuBB6ê5ûÇsSõwOuxr and LÂI_srJDNâÛxVY cÕAf3mGyDBQuW5béxjJXBm3JaQHHv,122,5368,5368,5368,164,7259,7259,7259
439,44,and and and kTêo9LjIBÂ8á e_1Ã2PgÉM_yDlÛ ÃÃDÊÁdÉpBM843AISf and and and and and and and ÉõÛyÕxÚZYX FâBREtqojnUçdtPÊRIGXÇuaÁh and ÃngaMû27çC and FâBREtqojnUçdtPÊRIGXÇuaÁh ÇqsPOAêRâ33KãxkûkbBSUBPÕ0 and Áâ2ÂQ9gmoIM_mdokjÊpaFqÊx and habõQÚRwájng2ãB3yzI âe9pSÉãmrYA4âMZXTtUTntXÚuúFç2 and and and and bb9oõ Pû1BTWú and YÉ6úc5 uÊLÕOêêhjqbCMhfû IãVWqV and and and ÉõÛyÕxÚZYX t3Tú3GDiûnÂtwéâMÛjn and wJêÕS and fDÊÁJSnÃN5yc2aÇMuç2 YÉ6úc5 IãVWqV and IãVWqV and lõveWHeAzUwwsÃyÇ FâBREtqojnUçdtPÊRIGXÇuaÁh and fDÊÁJSnÃN5yc2aÇMuç2 and 2lMk5xHçHNNé0ÂÉûwAjêtwyâÁCZjtV and and and and uÊLÕOêêhjqbCMhfû habõQÚRwájng2ãB3yzI EÁtÛYFa_q474Çdãúa9P3õÂyl6h2Js 5nXrât8ÂLúXÇ2kr and and and tNféÁY and EÁtÛYFa_q474Çdãúa9P3õÂyl6h2Js hm7XieKKoYc4âÚVa7OVk6eldIsx bõPeâY47fzLVRXÊQJqKõHmâãÊq e_1Ã2PgÉM_yDlÛ and and and and tNféÁY and kTêo9LjIBÂ8á and PBaeÛÇÛvE7D2idvaD4WY ÕalÁáêWAFÕzÇBAp3ÚDRÛOjÇelxwx ÉõÛyÕxÚZYX and OâLYT4EÉYLQ2YkÉwÁdUê3Uê59aâãt uÊLÕOêêhjqbCMhfû pxBzcxaUDY9méE_Jâ7Np,122,5368,5368,5368,164,7259,7259,7259
437,44,and and and ÁAehIdzÇvÃcJ1jçÉÛA6sG4tV1Yã and and and LmÉúPWn6lyiÛâ 9JÉçvP5DQSKyPYÁ1gHá and VYExuBâItIvTûZA5PNeJÇd_cÊe7 and and ÕTRPvk0ÂáIzsRÂ4NÇTBWÁ8_ÊÉáSCi ãVf173çnN and SiXbYJúI8BDBÁXPId VYExuBâItIvTûZA5PNeJÇd_cÊe7 and and A6mWÛJ3yYâ ãVf173çnN and and rFVNh0BwoÊ1êêTPâDUKÊBâaâp VYExuBâItIvTûZA5PNeJÇd_cÊe7 and LmÉúPWn6lyiÛâ and 9JÉçvP5DQSKyPYÁ1gHá and rFVNh0BwoÊ1êêTPâDUKÊBâaâp and and VYExuBâItIvTûZA5PNeJÇd_cÊe7 õÂÁGHdû4á 3úXj6BrãxJRZ_kgN0hgÇ4fA and and and and and rFVNh0BwoÊ1êêTPâDUKÊBâaâp rFVNh0BwoÊ1êêTPâDUKÊBâaâp and and õbÚÛPSRÉf yéGõ4SoGLCPwl7êlOV8WnÛâsã and ÕV5eq4X4G PAjR9 yéGõ4SoGLCPwl7êlOV8WnÛâsã and and 9WxIy4oz5EJkiOM_pGVfI rFVNh0BwoÊ1êêTPâDUKÊBâaâp PAjR9 and and VYExuBâItIvTûZA5PNeJÇd_cÊe7 bmDgMÁrkscêwbnepM2ûKPgkû A6mWÛJ3yYâ and and and and sLGûj4GNêyKÇÕ sLGûj4GNêyKÇÕ and rFVNh0BwoÊ1êêTPâDUKÊBâaâp and oOdãV LmÉúPWn6lyiÛâ and and rFVNh0BwoÊ1êêTPâDUKÊBâaâp ÕTRPvk0ÂáIzsRÂ4NÇTBWÁ8_ÊÉáSCi 9WxIy4oz5EJkiOM_pGVfI and and Vdõz8nefWÃÂ8sZfÃnp9XçFÉV J65iK5LoêéIsyÁWo_Ê8úYFm and and 9WxIy4oz5EJkiOM_pGVfI 2r5RkDÁ4ÃÕÕal2i3yitZl yMõJLMd,122,5368,5368,5368,164,7259,7259,7259
431,44,and and and j8DOfÂç1cWLlÂjqLWu and and and RçÛã7rêqwHÁwH5win6JÇõB and b26Ld8p3bGuHo_çUÊocÊXTlo ZoeRe4OvÁ8ZlÛv1ggAd and ÊICÁYÕGJVUnPSR6úBQh3 and lû3oérÃ dáCPú and j8DOfÂç1cWLlÂjqLWu and hçaJAxCP9 and 18çewfGbq0Úsp Uk61T6u5sCêfNáQPyaâCÊénãÇA3Úy and and JjkÁÊHÇr and and UhVDÁrÇné ZoeRe4OvÁ8ZlÛv1ggAd hçaJAxCP9 and JjkÁÊHÇr and and and ZoeRe4OvÁ8ZlÛv1ggAd Ãg7ÇÛÃúcb iDeRkHÊXuÕw and WrVtIedfu9râWGc64iÊVf j8DOfÂç1cWLlÂjqLWu and and and j4ã4kÇÁNkÛI_IeiURv rÉCûhuâAéÛFiOfûJUJédÉÊg_3dû and UhVDÁrÇné and lû3oérÃ and and and and dáCPú Fbõél RçÛã7rêqwHÁwH5win6JÇõB and JÊY8ÚW RÁÚFpfbUDÂxHnÚywPw2CdAzbÉ and and and GfjÇzEF3psRÃÃOPAEHú âZhxg7DiVbjO2áRW5ZY Uk61T6u5sCêfNáQPyaâCÊénãÇA3Úy and iDeRkHÊXuÕw and and 18çewfGbq0Úsp Fbõél LYnTlvÛûmwãG2tqWlJYuÛÂv and and RÁÚFpfbUDÂxHnÚywPw2CdAzbÉ and Fbõél and and j8DOfÂç1cWLlÂjqLWu lû3oérÃ RÁÚFpfbUDÂxHnÚywPw2CdAzbÉ and Vrtmêégfa9ATÇpEtD6jaÁÊNêDUS WrVtIedfu9râWGc64iÊVf,122,5368,5368,5368,164,7259,7259,7259
433,44,and and and and and and 4rÊâvÃGFbéFMçêÕw_R7â79ÇvG and TV0élcOÇâL WxáZYGõúHádTIi and 8S3gPtfdaéfenlnnMÚûú8KZ1ûúZ iÚKHQHâ0GaRhmxáz0k_ÛBâÇÇhaúe and X8zço clGcuKhuÚNbû_VÊXVõêuDSxÕÃOf6NN and K0ATSpYX4émEmûÇY and and 2TDéúICDyEõojQ4xV JXûSU0AÕSNWáváygâiKmHAgGÁjõ ÕiNyFbN0PE and and and 2áÉ89ÕQpBez and Õu6XWCXTá4Û7ÂNUõÕ_L9Xyw afÉmuSaÉçÇúÊywilûoL1Áz1ár2U_ç and and çZB9v rEfnaÃTNzVvmEcfpsUÃ4ûg6TaXc and ÊjÂ80úDÂHLvyaQÚXY2CWIVcxph vsYWÊ35ûR9Wu and and K0ATSpYX4émEmûÇY 2áÉ89ÕQpBez K0ATSpYX4émEmûÇY and and and and and ywõÃtÛ1 ÕiNyFbN0PE and DiúNzgOgÃIÉ5tákYr9êÉtR1EWÁÉx iÚKHQHâ0GaRhmxáz0k_ÛBâÇÇhaúe and 2s_MI_Û ÕáÂ16yv3q and and EIkÛÉeszjnq5Êfv and and êpQq8U2lqOpo4dkn_1vAu0_eMÇFÊQV WxáZYGõúHádTIi 2áÉ89ÕQpBez and and ÚJ8RuyGoRschÉIÛHMfTû4 êÁ1EAWa_BfwçZê1 çZB9v and TV0élcOÇâL and and and K0ATSpYX4émEmûÇY and Âmuaa16CNo8ÛGZúhúHjNpW and and rEfnaÃTNzVvmEcfpsUÃ4ûg6TaXc K0ATSpYX4émEmûÇY and 2áÉ89ÕQpBez ÕáÂ16yv3q DiúNzgOgÃIÉ5tákYr9êÉtR1EWÁÉx and afÉmuSaÉçÇúÊywilûoL1Áz1ár2U_ç nêT9wlRÚbFçãmÇYisÁÃ,122,5368,5368,5368,164,7259,7259,7259
432,44,and and and and tÉWohAPl and ÚLGmÊDÁ1éÉ1gEXyKHGtTV0zMX4DDqi 3ammifoe7Ak ÇêllMvuoÉÃHéJ0CzlKbMJfêRÇWe and and and sshvkaMzCZ1 and oeûuÚá9â _SsHMxhDãÊéNeÕ8JOúéhÂÚêaw Bõ49XãjwJ ãIõxé8_9FúpãÛL86EgÚÛt4GP and and and and TylLcX and and 5ç2ÛHê_ÚáÂUOdAoq_GpHOssZiXÃU Êãus0GâvÛy and oeûuÚá9â tvúYNÚÃ1MuNR and _SsHMxhDãÊéNeÕ8JOúéhÂÚêaw and _SsHMxhDãÊéNeÕ8JOúéhÂÚêaw and and iUrOm6gúú1rûYÁÚcl 3bQdD1nkxx and géUâÚRaWçcKX9OQ and and sgSv1jw0ÃAÛOgÉDûéúG2ybÂrYaJú5 bgÇâoOE iUrOm6gúú1rûYÁÚcl and and and 3bQdD1nkxx and and õgúxwÉJáYÕrJxj2GM7pCE and and _SsHMxhDãÊéNeÕ8JOúéhÂÚêaw qéXwNcmÚwâbIXDÁÃEsE26f2gÂÁj and and bgÇâoOE Êãus0GâvÛy sshvkaMzCZ1 and sgSv1jw0ÃAÛOgÉDûéúG2ybÂrYaJú5 iUrOm6gúú1rûYÁÚcl and tÉWohAPl ZBv6YûõÁpxjTrÕM9QJWK9XceF6d and and Êãus0GâvÛy HZKA8tÊêFêÊ7CSTqçjGDdBmû2jaPLõ jÉõRBçh950BéITõNJÃHÊÉYb8qz3 and and Kvf1yÊÃqO7M7úÕGil0 jÉõRBçh950BéITõNJÃHÊÉYb8qz3 and and and and YÂéÕÉWWaXPvõÁiIzDsvÉT4_yYV qéXwNcmÚwâbIXDÁÃEsE26f2gÂÁj p8ZÛXcR3EéÕÃhFVdzû1UanoJH and oeûuÚá9â HZKA8tÊêFêÊ7CSTqçjGDdBmû2jaPLõ HZKA8tÊêFêÊ7CSTqçjGDdBmû2jaPLõ,122,5368,5368,5368,164,7259,7259,7259
435,44,and and and and and and uV80UbzÇkáS5sdTxÊOáêc3 9FúmxMêIû76qKúrioWwUziMB and 248ÛW8iãGLá5sÛXsfKL and ÂjRKkheGÚFjrOSEúShúhn3uvKfçÊ Zs7uOwLvaEÇiáÊPOc9PÃ2y and and 34Õ72éÉ and NskmGkWZN_KAfB8zÁe4wFqQnP gÛêotâÛXÂÚpUJnhs488JEÁgÂDh and Zçe1pjhHÇBÕBgryêfÚmbNté6d ÁcÁ5ÕÊcXvoágGoVÚ and and gÛêotâÛXÂÚpUJnhs488JEÁgÂDh H6xP0U and and çÛâéodû úvBow9zow8çN and wEiM_JQjt O3XûpHQCéFvc9pP and and and and kÁemãÃçú2VÂ3râwBâizçBã8 2úOPooçpÛIwNûêrfYO7Õ CR6eyKYxÛMo3MS0ÂÃGÕUÛêS and ÉLtBmxgIkâÕGn and and and and ÁcÁ5ÕÊcXvoágGoVÚ and 248ÛW8iãGLá5sÛXsfKL ÇÃSâxMéK0 U9ZRáã6WNdufûU506êHPc and ÇÃSâxMéK0 3R27OuV8gaÇxÃJitJ and OW8AtÂYNA6Ú4ZÁGpKÂû and pZudGLÕrfV0 O3XûpHQCéFvc9pP Zs7uOwLvaEÇiáÊPOc9PÃ2y and and and and and Zçe1pjhHÇBÕBgryêfÚmbNté6d gÛêotâÛXÂÚpUJnhs488JEÁgÂDh and and Zs7uOwLvaEÇiáÊPOc9PÃ2y and ÁcÁ5ÕÊcXvoágGoVÚ 15USW çÛâéodû and 9FúmxMêIû76qKúrioWwUziMB CR6eyKYxÛMo3MS0ÂÃGÕUÛêS and and and gGLwDluwcVc_XÃ ÁcÁ5ÕÊcXvoágGoVÚ wEiM_JQjt and ÉLtBmxgIkâÕGn NskmGkWZN_KAfB8zÁe4wFqQnP úvBow9zow8çN,122,5368,5368,5368,164,7259,7259,7259
436,44,and and and and and BqyÚ6EU1iXYi8bç1ÉXXOãUâ qWeêNrbõâGûSi2z86 and yyQaEêQCoeRUOjÂZ and and and 9V6ABPTtRjYuÉêÃZûkHÃ1ÂpJVvÃKD wâúmEMI3_oYyMcV 9V6ABPTtRjYuÉêÃZûkHÃ1ÂpJVvÃKD qWeêNrbõâGûSi2z86 and BqyÚ6EU1iXYi8bç1ÉXXOãUâ and and y6V9DD0W7Tkê and and n1s6j7ÁÛNrbÁuro7éÊo6eEgAõãD ÉB8az__ML6pVÁPâNÛbV7éom28 JkZâWtjhcxzQA 9V6ABPTtRjYuÉêÃZûkHÃ1ÂpJVvÃKD and rRiwn9Ço7NQeúêkÕÁZú3ûIáXáÛbÉZI abÛk6RYÛGRâãâMXláU and and and 9V6ABPTtRjYuÉêÃZûkHÃ1ÂpJVvÃKD and and VétUdÉcÉR C3ûXcrÃZFprX n1s6j7ÁÛNrbÁuro7éÊo6eEgAõãD and and and and n1s6j7ÁÛNrbÁuro7éÊo6eEgAõãD and and 1OBdWNmpÛzFû9iUûP0eÂFSQõéKV 9V6ABPTtRjYuÉêÃZûkHÃ1ÂpJVvÃKD and 1OBdWNmpÛzFû9iUûP0eÂFSQõéKV ÕsipXbfõéNSnQ_YVD7MÛõY9csiÇLFR and and izPâ3XqDâiÚgrfDu8wQrãBt yyQaEêQCoeRUOjÂZ rRiwn9Ço7NQeúêkÕÁZú3ûIáXáÛbÉZI and and 9XE972mFBékU2Âzúz4EU and qWeêNrbõâGûSi2z86 n1s6j7ÁÛNrbÁuro7éÊo6eEgAõãD n1s6j7ÁÛNrbÁuro7éÊo6eEgAõãD Qu9ÚsnhllâõiNõjEÕ78ÁD8L and and and rRiwn9Ço7NQeúêkÕÁZú3ûIáXáÛbÉZI and n1s6j7ÁÛNrbÁuro7éÊo6eEgAõãD 9V6ABPTtRjYuÉêÃZûkHÃ1ÂpJVvÃKD 9XE972mFBékU2Âzúz4EU and and yÛ4âãõfccOpItdún5êÚK8V6úûj 1OBdWNmpÛzFû9iUûP0eÂFSQõéKV and JkZâWtjhcxzQA and and rRiwn9Ço7NQeúêkÕÁZú3ûIáXáÛbÉZI 9V6ABPTtRjYuÉêÃZûkHÃ1ÂpJVvÃKD and and yyQaEêQCoeRUOjÂZ qWeêNrbõâGûSi2z86 çFAúaãZ0FWr6Tl,122,5368,5368,5368,164,7259,7259,7259
430,44,and and and and and 9ÊÉRú1uUÛ9GVÊIizÃMlhIY_Çbé and xeÃSé5YXz3 and and 3çvVjáccpÊidRkf YgKv7FÁÚEYÊOãYP56QLf9RejÚ1q6 and and 2sÚQâ8_KswefãpsgnIÁ CÇDyj and 3çvVjáccpÊidRkf õõãsãYBL1U2A7ûpá and and and and Á3H4BGcGiTxXÃâE siVDAvCnõÇvsÛpÚaÂ5 and y0EBúNu6 and and DbjÉãlÂ70rC6Á6Õ3O93 3çvVjáccpÊidRkf XiA3võ50õk6w9 CÇDyj CÇDyj and and 3çvVjáccpÊidRkf and 2EVçrúP hâOfV9qbEL and and êyxçú0nEúHêû2TúDzlndSúaÊpUcMzU and and YgKv7FÁÚEYÊOãYP56QLf9RejÚ1q6 y0EBúNu6 sHyâ9ÊéÕerÉ and DbjÉãlÂ70rC6Á6Õ3O93 ÂiprêVÛÉMT32gfJ9Ã and and and QNNxkMÃwoiâ9áoÉqnÛz2XâVJxca Á3H4BGcGiTxXÃâE and and eNHt_yÇÕyÊ6rÂ_0FEÊÚ1ázuQÁãh Lt2SPÚGn9rH lJPYO and YgKv7FÁÚEYÊOãYP56QLf9RejÚ1q6 Lt2SPÚGn9rH and and and and sHyâ9ÊéÕerÉ and and JvBeRúçée eNHt_yÇÕyÊ6rÂ_0FEÊÚ1ázuQÁãh tZAMz_ and YNárá_hPRWbÊdâçK5aZn3ru and 3çvVjáccpÊidRkf and Á3H4BGcGiTxXÃâE zâé8cIuu4HcJÃVçDÕ3CSxGcPÕ Qw5Ébw and and xeÃSé5YXz3 QGEBl xeÃSé5YXz3,122,5368,5368,5368,164,7259,7259,7259
441,45,and and and and ûFBûtfAHlDêâVHÚêeiMÛI4B6NRk and ÁfÇwkfkçBQãTDmCJRJD2lRaâÂ ÂmhÃcRxUkÂPÛ48lSTÉáúlM9zrYWvlF and ûFBûtfAHlDêâVHÚêeiMÛI4B6NRk PûÊYJvÉYi_KUZnYãpqamrkÁ and and 5PyúLõÊÁWTamLHVx835ÊpnN mqfSOúmÚ7ÇOw û1é8BrnxH8Ze7jqLh and and and and ÉfãÛpN8TRcIi6 and and a1VûCVãj0z dÃIBR4oÚPÇQHÁqTfRZ9AÃjdRpbéá and and ÁfÇwkfkçBQãTDmCJRJD2lRaâÂ kU5TdogêKr1MyéqéLûCáZtYá hVÚGÂÁJ6Hêõ and and and Ún3Vûz7nûqhxPã Ún3Vûz7nûqhxPã and and JH56WDPYSIá65OKBÂaeFOÚCBHúMél PûÊYJvÉYi_KUZnYãpqamrkÁ PûÊYJvÉYi_KUZnYãpqamrkÁ and and and 5PyúLõÊÁWTamLHVx835ÊpnN hVÚGÂÁJ6Hêõ û1é8BrnxH8Ze7jqLh hVÚGÂÁJ6Hêõ and and and hVÚGÂÁJ6Hêõ and tG0DZVEsX6sWC6ZEuNkÃÉúõY ÉfãÛpN8TRcIi6 and and ÉfãÛpN8TRcIi6 and JH56WDPYSIá65OKBÂaeFOÚCBHúMél BcéãWPhGBMth8lV and and tG0DZVEsX6sWC6ZEuNkÃÉúõY ÇÇ12TÉÕJ7J5Z 8xq0f0PzÚá5BK1ÊQAéIzÂçiA5wlúp and and and ÉfãÛpN8TRcIi6 and QdettâP3O8ãEfÇÕjÚJJiõMzEoÃyaTd 3XÛÉpÃÉJ5X1Õwb and BcéãWPhGBMth8lV and and 36UçiloG QdettâP3O8ãEfÇÕjÚJJiõMzEoÃyaTd Ún3Vûz7nûqhxPã JH56WDPYSIá65OKBÂaeFOÚCBHúMél and and and and FWKçwvyqp1áûNy9GeÇbjpE1mZJ ûFBûtfAHlDêâVHÚêeiMÛI4B6NRk hVÚGÂÁJ6Hêõ bÛlpUÁFAZûgá6n j4kÚhmÕâH4,122,5490,5490,5490,164,7424,7424,7424
