run_id,policySize,policy,len_c0,len_c1,len_c2,len_c3,len_c0_encoded,len_c1_encoded,len_c2_encoded,len_c3_encoded
253,26,and and and and xãõõOgmcCSm q6POua and Té0orÂáÛxLÃãfXwFy8á and and 6kVé9vGp5éVXOSBBVâÛ 0ÃÃN5pCPF1daqteÚVUzihrrzKObUÇ _rAtAEéÃõáÛPÇÕQmêrQWsÚxÃEgW and and xãõõOgmcCSm and 1rFu129Õz4GJûFgTÕEÇzÕãMÊt4J and q6POua xãõõOgmcCSm and Xçy4EKÚTtYõqM7tláûÛ56 and 2ûyÃ6f6HÕpE hm6Sv59dm9GÁ37Wé and and HéEc9usâGvfêad9ÊjJãfFêrVp and e91KÁâcTM8b 6kVé9vGp5éVXOSBBVâÛ and and Xçy4EKÚTtYõqM7tláûÛ56 and and odAHIgb9RõCgBÊRûkJÛÁvâsv GnybÁCssf0gREZÊçbX7 and and 0ÃÃN5pCPF1daqteÚVUzihrrzKObUÇ 5Gq0ã4dZ6 TvúpCGÕIpN_Vnân9jõNX and and and lPeMsIs8WgkfO5qD2õwnQlNgq6pt hm6Sv59dm9GÁ37Wé áN2jwx TvúpCGÕIpN_Vnân9jõNX,122,3172,3172,3172,164,4289,4289,4289
266,27,and and and and ÉõNm8fçk6QrfrûûláÕ7VÚÇGYtIU and gg0tnd8ÇÉ0á5N 7ÃumRçSMD4vvQ and 5TÇAclzÕÂXuÛBâZFmiwÛTW and YÂhTãrTáKH5õõ2DYtWHx7 wM9nEõ9õ4f and and mÉGKûás3QKT5ÊirpPao ÇIwJlfZiFmúavrÕQ7úq68Ú wM9nEõ9õ4f and and and Á_aVÕHZgVyââv and ã69Wsû6rgUÛÚhÕâ_eÛkA3WK_ghÕlbH Np74p0bS and and WsdvQOcq_ahxÊm and and AaoFbg3yZFXoP and ÉõNm8fçk6QrfrûûláÕ7VÚÇGYtIU 5LbJaWVX_31Û Â9CáãrKáõR2d2lKQãI and and Â9CáãrKáõR2d2lKQãI 5LbJaWVX_31Û and WsdvQOcq_ahxÊm WsdvQOcq_ahxÊm and and 5TÇAclzÕÂXuÛBâZFmiwÛTW and and ã69Wsû6rgUÛÚhÕâ_eÛkA3WK_ghÕlbH and AaoFbg3yZFXoP AaoFbg3yZFXoP UvtokZKmêÇúktFéêéâsG wM9nEõ9õ4f,122,3294,3294,3294,164,4454,4454,4454
267,27,and and and and and çt8eYaZTgBêA2gYJÃS DyxvrOjDQWXTO5Éqs6VzAMhêásKAr and DyxvrOjDQWXTO5Éqs6VzAMhêásKAr Pfs0nlOA1dpMPY TbÂTõX6hNsér7oÚjÃfanVKúZ GCmNNgVJxdgN2aújIggâPiWRkEyGé7 and and and çt8eYaZTgBêA2gYJÃS 8y5oÕ7ÚÂÃ9oq and Pfs0nlOA1dpMPY and and 0AXVÊTNFNViybtUûjÛ çt8eYaZTgBêA2gYJÃS Pfs0nlOA1dpMPY and and and and and pÇEvUÛÁGçeaerukzâqÊCáqlI_ê2k and yrtbGéÉ7û4ã5úQZ TbÂTõX6hNsér7oÚjÃfanVKúZ and HVâ9MeRcysPNRNKpn89ÊÕEúÇÁ RdÕcUFXMPkQêéám and and RdÕcUFXMPkQêéám DyxvrOjDQWXTO5Éqs6VzAMhêásKAr and 8y5oÕ7ÚÂÃ9oq o6wq1RêeqÚç38JdBmArqKoÇÚK and PÛJvYÃKÁDeUmû_ÇÕ03ÕW3aoZ9úmTb HVâ9MeRcysPNRNKpn89ÊÕEúÇÁ and and and Pfs0nlOA1dpMPY TbÂTõX6hNsér7oÚjÃfanVKúZ Pfs0nlOA1dpMPY IyPáOtÉD1úubÃJSÉâãqt,122,3294,3294,3294,164,4454,4454,4454
264,27,and and and and M0nCúUFdûÃÇ1ÕPL and and 3ç37ÁiõbçÚA_ybFÊ4n6YoÚjzéjJM2b kBKêS_CLzJe7H EÂeQÂÕKÂãâAénpn6Bõu and 3ç37ÁiõbçÚA_ybFÊ4n6YoÚjzéjJM2b xoYSRGN 3ç37ÁiõbçÚA_ybFÊ4n6YoÚjzéjJM2b and and 1êÇÕõ and and and and and ãzÁYh3ÚpÕFBkxÚNYohyzCDÁKx Oi5iûnyúUDpâ9xVrÂÁûZRÊr KfCdõNq6BõFqáhÇUoJj rç91C8Y1QC and and rç91C8Y1QC ZWrlwnÇ7CtMcsÉH and 3ç37ÁiõbçÚA_ybFÊ4n6YoÚjzéjJM2b dwUVÛLSÂGhtbÊU and yBu6dSMé87Ç3uCqÁAMbPZRY8 and ZWrlwnÇ7CtMcsÉH ãzÁYh3ÚpÕFBkxÚNYohyzCDÁKx and and and sOUuk3oiL3wã 3ç37ÁiõbçÚA_ybFÊ4n6YoÚjzéjJM2b and and gZeieScNsKP2LZfû0FYf09KB7YZ and 3ç37ÁiõbçÚA_ybFÊ4n6YoÚjzéjJM2b rç91C8Y1QC and xoYSRGN ZWrlwnÇ7CtMcsÉH AleWéibiçX6,122,3294,3294,3294,164,4454,4454,4454
265,27,and and and and and ÉúszéQOáSOB4ESGÂsiûKúlãI Ã4lShVeN and Ã4lShVeN õ3çAêçâ32çpûéZGÁwá and and and êãYSÊKD 27s6DÁB4cp3_kl5Ê8109Ç2iqL vã2oDqÉARn and and and êãYSÊKD EÃÊÁJDBwGgÂtSUaSILOoIEgZâ and ÃTAoin04 and and and r_1mC ÉúszéQOáSOB4ESGÂsiûKúlãI 8605ÃOEdIOs çvIzÂGRzyÃNuPlãpHw6âNÊwÃÇv and and éÚaeSáDO4tÇÁHUêl Gns_fêuZÃ8zc jêKXF9VG0 õ3çAêçâ32çpûéZGÁwá and and and and êãYSÊKD Hi4X1JJEê1GtYQ0KyçfR11 Hi4X1JJEê1GtYQ0KyçfR11 and PO6yxKMpg9dl and PO6yxKMpg9dl oõEVu2rOD_rênnõYipir_ÊÕã and êãYSÊKD and 8605ÃOEdIOs oZeQeIPÇjêÛhyN00õFCPkÊUNâxc,122,3294,3294,3294,164,4454,4454,4454
263,27,and and R8HéÛxCJ and and TG86M7vqANMiõdd nÉVçRÚ075dnÚÃzKûÇêû7dhxÛTnO9M and DÇGfVHl_LOp3ÃVBo9cbéê7EhbO and R8HéÛxCJ TG86M7vqANMiõdd and and and and and and TG86M7vqANMiõdd hÃ6l5sÂzRhÃo xbfCêF4kÂÂQeNa and BaS2éxçh0RÛÛIY DÇGfVHl_LOp3ÃVBo9cbéê7EhbO and DÇGfVHl_LOp3ÃVBo9cbéê7EhbO JáIráVeOOqAõV and and and 1iJbSS0X TG86M7vqANMiõdd and BaS2éxçh0RÛÛIY TG86M7vqANMiõdd and ÉfMsn8J xbfCêF4kÂÂQeNa and and DÇGfVHl_LOp3ÃVBo9cbéê7EhbO and ZCiFD0õÚGS2 fpVR_DNÛRN5Õq4h and and and bcEfO_xiIg_UvÃYn3nobLÛo 1iJbSS0X xbfCêF4kÂÂQeNa and hÃ6l5sÂzRhÃo mÁõcÊm38õâLO4MW,122,3294,3294,3294,164,4454,4454,4454
260,27,and sÃmfÇOBÛVHê_mÁ2ÊpjYqSFB8IúK and and and and and tPFKn8Ê ÇT5qÁ_Çafb_qQÃF8qroéEbuõjBD sÃmfÇOBÛVHê_mÁ2ÊpjYqSFB8IúK and ÕKádOnúZ õRZtVEbés_AZÁwÊyXD5kU8ãC1Bc8dÁ and and and T3he42FpkbDY and sÃmfÇOBÛVHê_mÁ2ÊpjYqSFB8IúK ÇT5qÁ_Çafb_qQÃF8qroéEbuõjBD sN_çBr6Hxnb_jésSX and sN_çBr6Hxnb_jésSX 0fÂecuÊÁsg and and and and õRZtVEbés_AZÁwÊyXD5kU8ãC1Bc8dÁ T3he42FpkbDY and ÂdbS8EnDcQz0ZWyJbIÊUf and êÛQméÕd õRZtVEbés_AZÁwÊyXD5kU8ãC1Bc8dÁ êÁKxVrGúmweãÊÕâÂBj9ZNdvbSÂ0Hû and and fÇOÚhYJH 0fÂecuÊÁsg and and áûQn3 and õRZtVEbés_AZÁwÊyXD5kU8ãC1Bc8dÁ Sz1iÛMQOÕY6qhGqunÊF8âÁ and m_Ûqãmk3 and oTUãW and T3he42FpkbDY õRZtVEbés_AZÁwÊyXD5kU8ãC1Bc8dÁ,122,3294,3294,3294,164,4454,4454,4454
262,27,and and and and and and 3êcPõ1wÇPõppz5frYûbNÉVÃtfÚVzs 3BLVyh4 âFTQhyTo5ebVE2 and Gé30dab and and 3êcPõ1wÇPõppz5frYûbNÉVÃtfÚVzs VÊTjkGykê3_8HvHÁaWjKSHFv6bOhâc él5xhgûD6OájnÂxBcõc_y_TpÛé8ML_ and adtELgcFgpCÃ2BávYÉSPbiBB VÊTjkGykê3_8HvHÁaWjKSHFv6bOhâc and and and 8ÇH1oÂuKâ7Bõo6ZEDpkÕú and âÛDQxLAÊXhhZPãú and ÊY5_É2LÃ2ÛzAoÚÉ VÊTjkGykê3_8HvHÁaWjKSHFv6bOhâc and gjHLAUXqPS9Hz and VÊTjkGykê3_8HvHÁaWjKSHFv6bOhâc and âFTQhyTo5ebVE2 and âÛDQxLAÊXhhZPãú áMçõXq3J and and çEuúõekE 3êcPõ1wÇPõppz5frYûbNÉVÃtfÚVzs áMçõXq3J and and VÊTjkGykê3_8HvHÁaWjKSHFv6bOhâc gjHLAUXqPS9Hz and gjHLAUXqPS9Hz and and 8ÇH1oÂuKâ7Bõo6ZEDpkÕú âFTQhyTo5ebVE2 JÛ6fLzûâsiY,122,3294,3294,3294,164,4454,4454,4454
261,27,and and and fHõzCHõo PêjRcyb0ÚXRcXUsxqGuqUkiJBwxÃrz and YEIÁ7ÃjYfl0ç8LQÛVuKlPSXÕNlS3Â and and PêjRcyb0ÚXRcXUsxqGuqUkiJBwxÃrz YEIÁ7ÃjYfl0ç8LQÛVuKlPSXÕNlS3Â and and wÁÉ0pcBRSÃY1ÛÃmdÚ fHõzCHõo and and cCKF4ê7sqCêõPc6ÊtvÇÁhtLâFy fHõzCHõo cCKF4ê7sqCêõPc6ÊtvÇÁhtLâFy and and and and wÁÉ0pcBRSÃY1ÛÃmdÚ and Õ0a5êQû and FExbMyê3Fû2w 2ci8_wáÂt and mõmÚã3iAcÂ8oOq3KTûÉzé3ÂFácÛOU mõmÚã3iAcÂ8oOq3KTûÉzé3ÂFácÛOU and cCKF4ê7sqCêõPc6ÊtvÇÁhtLâFy fHõzCHõo and and YEIÁ7ÃjYfl0ç8LQÛVuKlPSXÕNlS3Â and and WitP4 omTâúv8uI8ú and mõmÚã3iAcÂ8oOq3KTûÉzé3ÂFácÛOU Û2a_ZkÁpRkuAúcéxY and ê1Ah0_ÂAWEãxPÕÕõ7 and Û2a_ZkÁpRkuAúcéxY and Û2a_ZkÁpRkuAúcéxY ZõrÁhSNs6wceEjT3ZikúõM,122,3294,3294,3294,164,4454,4454,4454
268,27,and and and ÂáqOj7ûÊfsânÛÁeT wõOéta4Gxé6pãzÊRvFzqLhEÉ and ZfSrHvçTlrOÉe0Ib0HãeVTút3_2lX and _VÇcMáweMç ruVU_PãlhRYÇdOjMÛãXÕa and and and and ZfSrHvçTlrOÉe0Ib0HãeVTút3_2lX and ÛGGgI1JA7QVjrH wõOéta4Gxé6pãzÊRvFzqLhEÉ V8XÊXCÚcqãq_iOqxjcgC and and and and and and _VÇcMáweMç FfÕEdV1hjp6ç0OAdû YfrÇNrhuGWDÁSS8 and ÛGGgI1JA7QVjrH HCwC4ÃNFR and ÚgY6amúRDÕCâ and _VÇcMáweMç ÚgY6amúRDÕCâ _VÇcMáweMç and and Úúi6cE5oj and ÂáqOj7ûÊfsânÛÁeT _VÇcMáweMç and HCwC4ÃNFR and ÛGGgI1JA7QVjrH ÛGGgI1JA7QVjrH and ÛGGgI1JA7QVjrH and ÚgY6amúRDÕCâ ÉU53ûgÚjgúÊhhdã9r96,122,3294,3294,3294,164,4454,4454,4454
269,27,and and and Unvw70epiX0fDIeÕJGKP and pÂpSEXOtxGFÕIÛátVé and HõoÁKNdZ HRÁIHGÃÕzsOãE14 and and and Unvw70epiX0fDIeÕJGKP and and uáP3NWKCê_CâçfúT5jçÂ yul4ÉÁmI2páeZáwáÃ5aÚZJ Unvw70epiX0fDIeÕJGKP and yul4ÉÁmI2páeZáwáÃ5aÚZJ jêâyxSEÕÚ and and fpÉuAN6áétÃEGõ77jtDJCj 8ÂÛÊR2dzF7J PnhhkÚéED and and and and nso5dûUkÊãFqkuKwpB5E0ÚbúhéÊd PnhhkÚéED and and Unvw70epiX0fDIeÕJGKP and HõoÁKNdZ Unvw70epiX0fDIeÕJGKP ZnfÃáBs0JugDûT1MnP6Oi and and dçúFûD2DÇKûOWYÇlâDÂjsEÕtFKÊçR tpzéõSXK6ÕwNÂJX_GjlrZDAâÇpçn and úyZÁúaVIbkNQgWhNyC_ cMHâpx and and nso5dûUkÊãFqkuKwpB5E0ÚbúhéÊd and úyZÁúaVIbkNQgWhNyC_ PnhhkÚéED n1m2hZê,122,3294,3294,3294,164,4454,4454,4454
270,28,and and and and and aPSáá and 9êKB6QYb2S7AAx5jIÛ and Vk7Sy3EYyúZOê6BAVsdúêl5PQz QeVQqrMeexoKÂECK and and Z_Wgûúle_JNRXtçKEWCaiÃZhT1û GkUYõC0BQMjvûcR8õ and ÛêX2ÃaIvPûtTFçûÚOiphKMjumMj pk4IWKÊuú and tIáR3uÊ GÊlTpPyâM9ÕtnV and and GÊlTpPyâM9ÕtnV Z_Wgûúle_JNRXtçKEWCaiÃZhT1û EVwÚ3NenÊ7FcAD6É9Ú_wh3SIzÇgir and and and EVwÚ3NenÊ7FcAD6É9Ú_wh3SIzÇgir zQARutUKYkB5c7CK5Ç a2âxÇ6CSOWZÊúyYûkÇC and and and and and dNÊqjsÃEOá4Ç9Jksb Ni2nçÇûjd8wtâÉEve6BKqçGjâEold pk4IWKÊuú and EVwÚ3NenÊ7FcAD6É9Ú_wh3SIzÇgir WõÃ7áKekÂPÚ Z_Wgûúle_JNRXtçKEWCaiÃZhT1û and and and Dm7Á9LCtmxe3amq and Dm7Á9LCtmxe3amq Vk7Sy3EYyúZOê6BAVsdúêl5PQz and QvsXi_ãM0 Ni2nçÇûjd8wtâÉEve6BKqçGjâEold Ni2nçÇûjd8wtâÉEve6BKqçGjâEold,122,3416,3416,3416,164,4619,4619,4619
276,28,and and and jãf_js3Gkch and 2MrCIy_pNxÚêÇ1_BúbotmIxRIMXvpZ kÃa1QéXCÊAûJb8 and and and and kÃa1QéXCÊAûJb8 fJl3Ã2ENOIf5kLRqcE6p7fJau jãf_js3Gkch and and and q3kLR8XoWÃ2PnbAixÊB fJl3Ã2ENOIf5kLRqcE6p7fJau PcõnH9qm_P6vÊyÁ and kÃa1QéXCÊAûJb8 jãf_js3Gkch and Wã5JkÁÂ5Âgsj Õ7ThÊGowká7RrmA8Q37Õláé2ûMjâo and and and jãf_js3Gkch DWKRFáT5õDNz3txÕXek_p and YjtpRzcpidDD and MzÃbKmÚYKx and and kÃa1QéXCÊAûJb8 and q3kLR8XoWÃ2PnbAixÊB jãf_js3Gkch and jãf_js3Gkch XjUCaRypznEOÚndÊygÃricADr and and ûyçJdMqXã6q and and 6fÊúwP2û8IâÇÛ9ARÂÃÁJQtBdúagéb kÃa1QéXCÊAûJb8 and kÃa1QéXCÊAûJb8 ûyçJdMqXã6q OQâÚúDúULp0_eoyNdpO1ÚéCxÇfoaV,122,3416,3416,3416,164,4619,4619,4619
271,28,and and and zZÇãZnLgXAÚiM6Õ9Áo6ÕoÛH0êtÁO 1KIqy5WyhbIej_RÕMú and and jmCq3âfPbSNCçtDJ and and and WÂHWyotn34ÂEYWyÊ6kPoá and 1KIqy5WyhbIej_RÕMú and and ês5NÊAtMdT 8LQLXNJUéN9xyil IDK4_Ûm3F_ãR and IDK4_Ûm3F_ãR XpBÂêTLÂÃúéoIEânáR_ÚMdc6ûÂf6m and and 1KIqy5WyhbIej_RÕMú and and dhXg9õ2cX7ÃÛ5ccfTCawúéenHUhÃ WÂHWyotn34ÂEYWyÊ6kPoá Ûud_L31ú ZoõÇCtã9Ûç7Eõ9ÉQÃxG9EÕ5êg1c and and and VUÛúuGTXorNmHLqiÊ 1KIqy5WyhbIej_RÕMú and Ûud_L31ú IDK4_Ûm3F_ãR and and 8hmmpPçeg7 SGb0ÊçYÕviHâIBT Á8kvGY4S0xÛfsBoq4Út and and and and ês5NÊAtMdT XpBÂêTLÂÃúéoIEânáR_ÚMdc6ûÂf6m WÂHWyotn34ÂEYWyÊ6kPoá YXXâDBCÚPnÂhMCEfrÁS6W2ÛQCkf and Ûud_L31ú SDdgIE2dp2Â3vÉSÕÚgVaca78OOÕ,122,3416,3416,3416,164,4619,4619,4619
278,28,and and and and X9uIuuoLOQJÚqvKÕç_mÂyÃ5zmÚ and RÂZyOÁÁ2Gé6GvKJUlf_ÇT Pis37dTJimdyhÊhREn and and ÕKQ9õjF and IÂChÁEçfãAwê ÕKQ9õjF and Pis37dTJimdyhÊhREn and and 2xÕsxwÊTúVtAfmûáFk6 2xÕsxwÊTúVtAfmûáFk6 and ez5âiçêfsÁqCWnI4õ 2xÕsxwÊTúVtAfmûáFk6 and and 2xÕsxwÊTúVtAfmûáFk6 ÃçFpa0f1pSNCDÃAwÊÚs and VZáû16SkxQ9jO5cÛúEççuxN4R2E6 2xÕsxwÊTúVtAfmûáFk6 and and and and and and Y0Ag67âW 2xÕsxwÊTúVtAfmûáFk6 and IÂChÁEçfãAwê ÕKQ9õjF 2xÕsxwÊTúVtAfmûáFk6 Pis37dTJimdyhÊhREn and and RÂZyOÁÁ2Gé6GvKJUlf_ÇT 1y3d0_M1 2xÕsxwÊTúVtAfmûáFk6 and and and ez5âiçêfsÁqCWnI4õ FfMrõqEÛJ975V65X7XT6ârYsHv7_ ÕKQ9õjF 1y3d0_M1,122,3416,3416,3416,164,4619,4619,4619
272,28,and and and and mBazdÚhúc_fÉ and and and 2çÊ6rBé6e2daÂMop KÛIl8cbDyQVÃMVQ5nvAÃgz9ûúÛQL p1JyA_9Ûvwkx and ÇPÂ_JOTÁúõXQyçZ71ofJJj bVM_ÂÇiNÇ79mYÁHqtpEêõmÉÂJ and and KÛIl8cbDyQVÃMVQ5nvAÃgz9ûúÛQL u2dlMõbEA00K p1JyA_9Ûvwkx and bVM_ÂÇiNÇ79mYÁHqtpEêõmÉÂJ and and and and KÛIl8cbDyQVÃMVQ5nvAÃgz9ûúÛQL and and VÛmZ4Tm ÕgxYÂÉúiÃX ÇPÂ_JOTÁúõXQyçZ71ofJJj and RU6DoRÃUQiX aTWvCgu1cjqXLÊ and aTWvCgu1cjqXLÊ u2dlMõbEA00K u2dlMõbEA00K and and bVM_ÂÇiNÇ79mYÁHqtpEêõmÉÂJ and ckéêNõo0GãZSjÂs and ÚBá1Fir9ÁSky and cêv7IRWÚú nû1HTXãvBRI9â7êLbC4rJLDM2ê and bBú6ÊzWVzE1éjÚHN5kZxVyHçzru3u_ and bVM_ÂÇiNÇ79mYÁHqtpEêõmÉÂJ and ÉdÂP3 VâKTdmFÇLePqÂ0O2nndA16sÉ1VÉzê,122,3416,3416,3416,164,4619,4619,4619
277,28,and gFRÉIhÁY7HKHMCâêÇY19Io2ÊjaOsq and êÁCÉúHéÂÚbCÚsUAxdM and and and and jwTVAINBqKjQeû âw8Wyr3ÂÉhMuçê6JNÇmiswcgiAFt ChÛERiÂUãos and and and and Uodopz5áWBl3â xãifÁVÛêM1UXÕã RÁÃygef7PÉ_Ú96Yjqe77PfqS and and and Uodopz5áWBl3â and 4ÂvÛeKL93D and and OÇr4fluVsmOûgFBzuê xãifÁVÛêM1UXÕã RÁÃygef7PÉ_Ú96Yjqe77PfqS 4ÂvÛeKL93D and Uodopz5áWBl3â RÁÃygef7PÉ_Ú96Yjqe77PfqS and and and RÁÃygef7PÉ_Ú96Yjqe77PfqS MhLTYÚrÃNHvVwx OÇr4fluVsmOûgFBzuê MhLTYÚrÃNHvVwx and and RÁÃygef7PÉ_Ú96Yjqe77PfqS and and and gFRÉIhÁY7HKHMCâêÇY19Io2ÊjaOsq and RÁÃygef7PÉ_Ú96Yjqe77PfqS gFRÉIhÁY7HKHMCâêÇY19Io2ÊjaOsq úh0h1l and RÚ0úIâR4Cn6irYfir xãifÁVÛêM1UXÕã Uodopz5áWBl3â,122,3416,3416,3416,164,4619,4619,4619
279,28,and and and and rsPVeD2DpMaúúLÂBTOáê0áú and and Éghb33lmohkPMkcéçt and Rg15Hãz3jÊâ ÁwÊqDÂQ JxãÚcfdCU8áuwDBOvhõAeH and and rsPVeD2DpMaúúLÂBTOáê0áú jJbfJééUz JxãÚcfdCU8áuwDBOvhõAeH and ÁwÊqDÂQ and and SHÛéOB0ukÇrezjÁj4WJFOOcÕs 5vúÚ867lkHÊvLde ÁwÊqDÂQ and and and 0OzÚÊMnYuHHm KjÂPûCamlRmkÊM0túy22LD8mx lIÚõ2uéibkbãÚje1foATwá2hNhRa8 and and and 0OzÚÊMnYuHHm vÇGÁLçScoÁÊhqpfrva mqgvw and and KjÂPûCamlRmkÊM0túy22LD8mx and KjÂPûCamlRmkÊM0túy22LD8mx ÁwÊqDÂQ and and and jJbfJééUz wéXAFÇKMIZréfç ÁwÊqDÂQ and LÂUrÂHwi5û_mêFHvÇádAQcé8hÃ3Cõ7 and zoêÊbMwugivr9Âê0_DÚõ and zoêÊbMwugivr9Âê0_DÚõ ÁwÊqDÂQ,122,3416,3416,3416,164,4619,4619,4619
274,28,and and and and çDGãSG and çDGãSG w8YéNÃsûvUÊ90bq2P REWdv2uAõHêúÂqf8xú6sELeef and and w8YéNÃsûvUÊ90bq2P w8YéNÃsûvUÊ90bq2P and and and ãanûsâHDwâçct1ERn uM3TUAãÕâb9prtY and nvxA4ÕAcOo5DsÕ1ÃÛgécZQwHBmtX ÕcÇ8ef uM3TUAãÕâb9prtY and and and and çDGãSG and uM3TUAãÕâb9prtY zúMÇW5L6HyEQdÇ0DBNlTMn and 1vk5gêiáÂÊERyoTQz and ãanûsâHDwâçct1ERn zúMÇW5L6HyEQdÇ0DBNlTMn and and zúMÇW5L6HyEQdÇ0DBNlTMn 7vGBáy5jeÃ0 and zúMÇW5L6HyEQdÇ0DBNlTMn and and ÉõáiÚ0ÂMPB5 éh8áGw zúMÇW5L6HyEQdÇ0DBNlTMn and and õ_sÚEriGXLây w8YéNÃsûvUÊ90bq2P and uM3TUAãÕâb9prtY and uM3TUAãÕâb9prtY uM3TUAãÕâb9prtY,122,3416,3416,3416,164,4619,4619,4619
273,28,and and and lãc7yfêNméS61IPxY4ÛâwHXÂW and gâQÉÂ hMldkçfzHncréUMeg and and and hMldkçfzHncréUMeg Úg0eOj70Ú and and and B0MaÁ4z2YVÚê fiuHÛ4rÕuç4ú4ZDÉAWS2rPBêXW2H and ÚêS3NRû2ÁurkYLfivCxtQp and çu4ã5gGuHUûçJÊÕQ6VãMv6 fiuHÛ4rÕuç4ú4ZDÉAWS2rPBêXW2H çu4ã5gGuHUûçJÊÕQ6VãMv6 and and and ekusx_BÛULJeVaWl5 and fiuHÛ4rÕuç4ú4ZDÉAWS2rPBêXW2H fiuHÛ4rÕuç4ú4ZDÉAWS2rPBêXW2H ÚêS3NRû2ÁurkYLfivCxtQp vdlçWJÉFÂmVçgSL and and and and and âLMnDvHbéçYé LjoHGAÛvÚ6XZuêyÇéjÛHX1pBred Úg0eOj70Ú õZVÁeokÚYRõÁÂS4Jlf215ÃRkãê and BL18ANZfÇúgWGtfVÂG9á_ûÂ_fC2gWa vdlçWJÉFÂmVçgSL and and and 4AgDâw9OwrÉ2lRP5HUGásBA and âLMnDvHbéçYé and âLMnDvHbéçYé zCâ_oLxNRAtyÛsû3Imu ekusx_BÛULJeVaWl5 âLMnDvHbéçYé,122,3416,3416,3416,164,4619,4619,4619
275,28,and and and êooeNR6êULDpnJzM2ÛSzc7Ê and 6HmWá0emOCxÁI and SLhÛÊÉáZOÇÕSúbLÇãpEDq9FL and and w2JBOÁLwosCy vjéRg_sl2 w2JBOÁLwosCy éjPOw and and and and and ÇieéAekÉ1uÂbW21r2ûHFskpOIÚâcã úFoXI8pxpFõMÚÊNB SLhÛÊÉáZOÇÕSúbLÇãpEDq9FL and and and ddÇwãccZ2NpûA7ÚYl3A dLúV6é and 6HmWá0emOCxÁI and úFoXI8pxpFõMÚÊNB úFoXI8pxpFõMÚÊNB and and ÉÕCDQáCTbrmxãuoadêê 6HmWá0emOCxÁI 6jÂPéIn6ã4CEjgû9fûqFk9ÕnÇd1 and and and and SLhÛÊÉáZOÇÕSúbLÇãpEDq9FL 6jÂPéIn6ã4CEjgû9fûqFk9ÕnÇd1 êooeNR6êULDpnJzM2ÛSzc7Ê and êooeNR6êULDpnJzM2ÛSzc7Ê and éjPOw ÉÕCDQáCTbrmxãuoadêê 2çWg2ûKtrlhPÛwQLNãKãW1UiÊpg and SLhÛÊÉáZOÇÕSúbLÇãpEDq9FL and SLhÛÊÉáZOÇÕSúbLÇãpEDq9FL ddÇwãccZ2NpûA7ÚYl3A,122,3416,3416,3416,164,4619,4619,4619
288,29,and and á7gKU0x3LçvWTjÇãÇf and and and and and YNúnpÂ4c9êN2kzO3éyrêBqNCdYúXZq PtoeAK8Â and hGGbdWqÇõ_vtâXÛa A9Vf8F9gBZgAÁmgGF8YÉmçdz7oé 5Y4cxva2 Nf13WF7na2úqZrzmwmi and and and DKÁJ6BCut1aPõé FAUD_HfÃaPX6 Nf13WF7na2úqZrzmwmi and 5âgHãÁJ49yt8U4ZéEaÁo C4Vo15âiabt2ÁwnG8LTfNcnuUça and and and and PtoeAK8Â and YNúnpÂ4c9êN2kzO3éyrêBqNCdYúXZq çûcÇnReêTTOrkoÚ4jÁvLÚiCfY and ÂuIPBk86ÛTúã8ÚX8yO YÛãUÁÂy9HeeUaAl and PtoeAK8Â and and QMPkxP2IRqSákOj5qE0xtÊÛJ Nf13WF7na2úqZrzmwmi iâÇB5lûrTê5_0çWÉ_OFÊFEaw5xoÊ and and and and ÂuIPBk86ÛTúã8ÚX8yO s8JlL79zmWúÁêayCnP9û SÚe4OO7q1 and SÚe4OO7q1 úf_IFeúÇfWui02w5UePLÚBqfE and 5âgHãÁJ49yt8U4ZéEaÁo and C4Vo15âiabt2ÁwnG8LTfNcnuUça JeEp6XE07W,122,3538,3538,3538,164,4784,4784,4784
283,29,and and and and éz1OhGxlwV9pUkõT4ÚWFB0jDémI and d1AwéyõúBûcÂHÉG9cxáÊ2dBÁZn d1AwéyõúBûcÂHÉG9cxáÊ2dBÁZn W85aGmãvMâ4ÁDÂpA1L and and and and and 8DE_RYSnÊZlÚ2 ÁAccCHCQKycfC3gxgI8 EeWÇ77 Cd4ãEÃéUWVú xúbhi and and and and nY4ÕÂÁ4jÚNú6g EeWÇ77 and EeWÇ77 and Cd4ãEÃéUWVú xúbhi yeõfa3t1féC1X and and and ÉEiûçKig EeWÇ77 xúbhi ÃcZXQãi__gDmzhÛÁT and ãAarCq4Oe4HYõJBRúÉQbAp1ú3õ and and and Cd4ãEÃéUWVú ãAarCq4Oe4HYõJBRúÉQbAp1ú3õ and and and EeWÇ77 and L7Ãsõ6iiÂWãmVmofqq EeWÇ77 and f6HÉ5MmJma3KlAõLû5raALáBnKÃ9FJ êRÛJGhÁh4çk3Ú4s EeWÇ77 tYeãdâGÚCAY4s_fiuhya,122,3538,3538,3538,164,4784,4784,4784
289,29,and and ÃDI6aI7aÕbwqÇQh7ûcuqyBK and and and and and VC_DiÁZqYn k_û03hÚEá5gxDÚbtMêjnâAKgu_JV k_û03hÚEá5gxDÚbtMêjnâAKgu_JV and and e5oÚêHAHHÕbR QY06uQg2uwzu and HTl0qMqy_ZQViEHêxtHúji3 HTl0qMqy_ZQViEHêxtHúji3 and QY06uQg2uwzu and and and ÁCQáú_Vst ÃATq7ay LCDBeHaSM7qp and and and HTl0qMqy_ZQViEHêxtHúji3 ÃÊçOgEúÕZltM23c and k_û03hÚEá5gxDÚbtMêjnâAKgu_JV ÃATq7ay and ÃÊçOgEúÕZltM23c and lioJuÂÃbp4kCM k_û03hÚEá5gxDÚbtMêjnâAKgu_JV and and fUpi4OF and LCDBeHaSM7qp sXdW82âaCÂQédÚb4õkR74ú89QYGDT and ÁCQáú_Vst and LCDBeHaSM7qp yÁÂqúCÛl0ÂÃXnvZGKGâÃl4 and and sXdW82âaCÂQédÚb4õkR74ú89QYGDT ÃÊçOgEúÕZltM23c and 8KiÉfQq_ÕÉYúiÂVnqõHYçPâ5m_ VC_DiÁZqYn,122,3538,3538,3538,164,4784,4784,4784
282,29,and and and and 3ÕhiááXLP YwOnÉt_aS7cmÚb5Õv0 BkSjQ and and and sO8áFãgdÇûOçÛLéeQûbOYvnBÁúX and DNâwL0wqêÚ8MrõÛdIG and WYL2oLhMzÉ3uÚEHÃIyfD33ûLêzX and ÕVipáKQlis5pZnêûoAyêeNfiÚyÊÊKN and ÛckgvÕpÕdsIF ÁáMEWmzs5 ÕVipáKQlis5pZnêûoAyêeNfiÚyÊÊKN and and eÊ0âzXwdCDqzp Âçwv0llSçxB and and NmbÇhçgRMÂÚwREiú1fúâBMãK6 NmbÇhçgRMÂÚwREiú1fúâBMãK6 and ÕVipáKQlis5pZnêûoAyêeNfiÚyÊÊKN ÁáMEWmzs5 and __sêêfÇÃã and and and and SêoÚFÊagOaR9dUyGl82ÂZTxxCGú SêoÚFÊagOaR9dUyGl82ÂZTxxCGú ÚmEAqésÉéXx04ç912lvGEtJzRlS7Âr and and FiUÁr0f2cLÊOPl8zÁdU3K_ÃÇjã9To cPFdKczIãÃAJhûãé_1õGç and FiUÁr0f2cLÊOPl8zÁdU3K_ÃÇjã9To and and and A_57yIÛÃcN7ÉnAKáFtoxMC SêoÚFÊagOaR9dUyGl82ÂZTxxCGú éãN890UumÚu éãN890UumÚu and âH0qXUe 21RãVÂQTÛDÊ9ÕlTÁhÂgOw3Â,122,3538,3538,3538,164,4784,4784,4784
287,29,and and and and VtDo9BOPe qb87bLpMÂ and VtDo9BOPe 6C4hB3ÛRbÕûFçÃÁ0 and and ÉqHWqu VtDo9BOPe â0ÚÉ9û2 and 82ÛewdHÚJFkeoZÂBaÚÚJ22_Çb and and and and QÛ_WVHH08z1UhgfOLxOw3AYê6ÚkâQ imÊ3RÂ and ÂÇjûVY and 1kfÇmLSlÛ and and VtDo9BOPe ÂÇjûVY and and and GjN2Cv ÉqHWqu ÂÇjûVY qáCÁGX8hOvTá4 and and OfnÁDcMwwp3ÕRwp_CvlNRTdém and VtDo9BOPe and tfBiOrJrkZÕaIHN__Tk 7Iõ6BGskVâYÛ6ÁwéLWKt and and M1qq5DD0qGA3oÛÉ QÛ_WVHH08z1UhgfOLxOw3AYê6ÚkâQ 7Iõ6BGskVâYÛ6ÁwéLWKt and and and Jx8yÉ8jéTpKçÇú2mé toEwÕjuPnV7tÃi1narSõOõãLkhayêL M1qq5DD0qGA3oÛÉ M1qq5DD0qGA3oÛÉ,122,3538,3538,3538,164,4784,4784,4784
284,29,and and and TãÛkj6c3KZÊrayõxÊ and and Ç1sêlidfjKPLd67AQ1ykÛn ÃlkAqCûTWúwHr1b5âT cTmABo_eMâWÛK1SAõoâYXlXvePfyÛ and wûH1ÂubT84 AAZÃAÕÂ1UûU5HÂqHdNWÚoM and and and and and 5tMÁtPéÊuhWPpbnÁ1GqUGsjJÕsRm 23Q9UWWánÃFâj4 çI4KnC ÉaVwV and and q2AÁsÂÉhoeS7VbQR ÉaVwV and and and and wûH1ÂubT84 wûH1ÂubT84 and ÇÊzLVveáLánPáum and and ofÉiYqÁoAtõs3asKjjkrcÉmbv j6v0pÉ8âúeV and ÉaVwV ÉaVwV and ÃlkAqCûTWúwHr1b5âT Ç1sêlidfjKPLd67AQ1ykÛn euxêFT_á7uF_hánM and and and and çI4KnC and WNgOPUõR LIHiÉûG1é6gw and j6v0pÉ8âúeV rjÁûaNnéatkÛYZr õTTâoêDâ04FaÇfpã Ç1sêlidfjKPLd67AQ1ykÛn,122,3538,3538,3538,164,4784,4784,4784
286,29,and and and and Y3sRÇ8Lv4ÕA1õVÊÛRgnizk _NhSoÊYKCMÛKâ67I0DocuÂ8v and ÉáI1LmyyNÃg4guH and ÉCao3 _NhSoÊYKCMÛKâ67I0DocuÂ8v and and JTzeÊ wÇ2âexO6õõaa8Fq5áYU7ZZ 3_kESbXlê and and and and ÉM9Ê2upZTOBÂ and fqQéW_OiúIbAmf72ÂÂnFF6áRyTõ ÉáI1LmyyNÃg4guH EcÁwbkêHçBaGGÁqtOlfDõ6ÂZc4Nõ and and _NhSoÊYKCMÛKâ67I0DocuÂ8v and vc0vÇéPi1TâÚChÃUÊXûéaéÃi EWuRXngc1AGjÇÊ5vzG4I and Si4oItxõWÛEOõ and ÉáI1LmyyNÃg4guH and lKiChkÚ and 0cKhlX9ÉMÕÉLY _NhSoÊYKCMÛKâ67I0DocuÂ8v and and and and fqQéW_OiúIbAmf72ÂÂnFF6áRyTõ Y3sRÇ8Lv4ÕA1õVÊÛRgnizk vc0vÇéPi1TâÚChÃUÊXûéaéÃi and eGZqSc_qu6dAúsÊnfqW JTzeÊ and and EcÁwbkêHçBaGGÁqtOlfDõ6ÂZc4Nõ fqQéW_OiúIbAmf72ÂÂnFF6áRyTõ and dDQõÇ08w2áXxÃNÕkvVÚBu nvyqZiMNl4oChYâÁçCÊeêâ,122,3538,3538,3538,164,4784,4784,4784
285,29,and and cWoTMiqtVmwl03mtldÊe2l and and and and DkJKçSCârIutÇ4ãûwãJÚ5cfHsO and 68MuêDaÉIdõ and 6eÇS1ÁL9BõAZ52uw 6eÇS1ÁL9BõAZ52uw and núÂgUp ç94iÂvçhFaGâÊõz5NHx1DDsÕ and and cR83K6ÊGyjTOêÃkeyxdp48jZ 6QQYêHãTdÕÉBEÚRÂÛB and âWd1XL6 and and cR83K6ÊGyjTOêÃkeyxdp48jZ âWd1XL6 and and B9Y9WMR4 4zwÕkGCzÂsÇ6j5úçÃsjCú9 núÂgUp KtwsÁIÚX and and and KtwsÁIÚX and and Aê2ucRÚvÚWon6FmãthçU2s and ÊAiÕhbvQã_çBÊáURÇGE and H8cçDSÇey_ZO3ÇÛÚkKI_ and B9Y9WMR4 âWd1XL6 and ç94iÂvçhFaGâÊõz5NHx1DDsÕ âWd1XL6 and and JázFfHÁNÉjghimdUHNiWa and yZ4JéçNkUIédcfOnykûm cáCBftDfçÉ8YMAOgúwrÇgP DkJKçSCârIutÇ4ãûwãJÚ5cfHsO núÂgUp,122,3538,3538,3538,164,4784,4784,4784
281,29,and and and ÃBwx7lg3YÛ and hhÇSf1çIxA7r9hBzOkÊC and LÃLéAÛIQV9Ik7ÂÚG0k2KqúzêõUXûU m4ûlIJjÊ1luv75 and and ã1L7FÊMzv8âAgVÛYYuNpjÉif tHqzx2C3â7zÁÁgOsmGYãSÃYÉjúo and and ÕyODDkFbTxc vhÃé9CaCYyZeWNRMqUwxsúT4çûã õgN0kÉÁU_ÃáoõúU04mû8 and and and and and tHqzx2C3â7zÁÁgOsmGYãSÃYÉjúo LÃLéAÛIQV9Ik7ÂÚG0k2KqúzêõUXûU ÚRÕÛobãpPM5u and 07rlT and Kmõ7E5Ãp7yMPBÊaY ivnúyÛZZûvxjé and ÚRÕÛobãpPM5u and hhÇSf1çIxA7r9hBzOkÊC ivnúyÛZZûvxjé and and and vhÃé9CaCYyZeWNRMqUwxsúT4çûã and and ivnúyÛZZûvxjé tHqzx2C3â7zÁÁgOsmGYãSÃYÉjúo and m4ûlIJjÊ1luv75 VÉAÕi6ÚVPqqDlSÉvhR90oÕ and RVX4d9p9ÃéÕGb mtotzXSlUÚv and ã1L7FÊMzv8âAgVÛYYuNpjÉif and and m4ûlIJjÊ1luv75 tHqzx2C3â7zÁÁgOsmGYãSÃYÉjúo ÕyODDkFbTxc,122,3538,3538,3538,164,4784,4784,4784
280,29,and and MâTJ87SQg QêdSãÚjÂÕdyCF9_Rbqxúzçáv and and and 2sÃsFiwúãQápÚDEs2ZÂâÁçYqÂé0õQ and QêdSãÚjÂÕdyCF9_Rbqxúzçáv _L85GFlu8vwmZKÃLÚWpûcfkfJI1Ê Hvûqz8HgÁUgsÁÛÂRõr and and and and and êuÚwmedvbçb4ZcIXÇ4 and and t5J0é8Cnû1hMãvÛtbWQW7é2ús0B8DQ êuÚwmedvbçb4ZcIXÇ4 and 9éM3Ks01Sd155JÂTaAPõXqLÃúaPõ t5J0é8Cnû1hMãvÛtbWQW7é2ús0B8DQ and and êuÚwmedvbçb4ZcIXÇ4 Hvûqz8HgÁUgsÁÛÂRõr and t5J0é8Cnû1hMãvÛtbWQW7é2ús0B8DQ MâTJ87SQg _L85GFlu8vwmZKÃLÚWpûcfkfJI1Ê and ÛIÚçyõQ and and and and Hvûqz8HgÁUgsÁÛÂRõr and he8çÂw0GBIYiJy êuÚwmedvbçb4ZcIXÇ4 and Hvûqz8HgÁUgsÁÛÂRõr he8çÂw0GBIYiJy and êuÚwmedvbçb4ZcIXÇ4 ÂP2ãlãwçÕ SP14S78XûUêeúÚ and r_q9INu8ls3ÁÂâ8ÚnwbÉ and and çêÛkf2D gÚSWwkoÕõõqqQnLKé1Rq6 r_q9INu8ls3ÁÂâ8ÚnwbÉ,122,3538,3538,3538,164,4784,4784,4784
296,30,and and and and and t5zúheaNl82Yê4A3mw85nbÁ ÃEaQTÛÁ_çNÃmRQ0ãmyVlçG and and t5zúheaNl82Yê4A3mw85nbÁ êyÂH2gCáÉIDE OVtuZÕÊ7V3kjU20NJsãfrpdhÚÉ7át JZâc6yÁJ and and LJAvE3zeLywmÃEz104_lqe2 aãJQKGA4úLÊ2myz0w ÊFqpLn3c and and and OVtuZÕÊ7V3kjU20NJsãfrpdhÚÉ7át and LJAvE3zeLywmÃEz104_lqe2 ÉGuDÉqânésÊEéõÚS7YOynlãGGbÊO and awÇ5ú6j and and t5zúheaNl82Yê4A3mw85nbÁ Cçzd81nXRFãhyÉ3hSnaçtBATÉãsHÇ and and Ú5mfaâPD79Z9 ÇéwDúoGÂg0 and OÁAPH and OÁAPH eHLJ25mA3ZiDHtv9ûTM8êãADâÉâ and and û5asmBõOBjE8XqLtztyrTQÛA0 and and ÃEaQTÛÁ_çNÃmRQ0ãmyVlçG LJAvE3zeLywmÃEz104_lqe2 and ÊFqpLn3c and and 6ÕÕM2yUúGé12oiLÂq4LOÉáRKVScgz wVQyaRnûÉ3YeP3knvEfX njZ5HYlKã3HOÂa3õKYKCê and Cçzd81nXRFãhyÉ3hSnaçtBATÉãsHÇ and û5asmBõOBjE8XqLtztyrTQÛA0 xEpvû5zIQÚv,122,3660,3660,3660,164,4949,4949,4949
295,30,and and and and SKê8DUfHgcTOãYvHçõXewÚ and SKê8DUfHgcTOãYvHçõXewÚ r3g9HáOvÉêBuÊáûIUhSAÃúTvDGt7 and and o_HzZ9RHpÃWtIK4gdYPJLR VTáezavwsrpGcÉ0NPAÃB8oÉCEvçáxD and ÕYA_5eháû15H0K3ã o_HzZ9RHpÃWtIK4gdYPJLR and and nndv5ÛxGxBdNvÂ 8KexWd SKê8DUfHgcTOãYvHçõXewÚ and and and and Hgoãy_lÂ and and VTáezavwsrpGcÉ0NPAÃB8oÉCEvçáxD and nlzYâqfUêrÛSázl and 0wxQtûbctLiBvXGHXNâQÚÃúxqG Aû7z4Met1OWyûRxã7ÂA60éC and C6ãgÇlÛZv78UUf9wEWÇã7 çTc8fv and and SKê8DUfHgcTOãYvHçõXewÚ uÇqDé_AÕÛ9õ1xzR and and nndv5ÛxGxBdNvÂ Aû7z4Met1OWyûRxã7ÂA60éC 0wxQtûbctLiBvXGHXNâQÚÃúxqG and and GiYvuûKõÉEC rTa3ê and and r3g9HáOvÉêBuÊáûIUhSAÃúTvDGt7 and SKê8DUfHgcTOãYvHçõXewÚ ÕYA_5eháû15H0K3ã and o_HzZ9RHpÃWtIK4gdYPJLR SKê8DUfHgcTOãYvHçõXewÚ Hgoãy_lÂ,122,3660,3660,3660,164,4949,4949,4949
