run_id,policySize,policy,len_c0,len_c1,len_c2,len_c3,len_c0_encoded,len_c1_encoded,len_c2_encoded,len_c3_encoded
343,35,and and and and and wKÉkER_SyÊÛLÃyiptyÛbFT õúzÇuN6bkwi5Tyzn7HÁfûfy BVZ5ApB64WqL1dÊYGê3õÁZÚtd8aúÊ 0ûÃGXÇzWR3m8OkS and and eRSVbêúwxULCQÁVúcyoÉb50B60ÕG and and and and and ÉQjâgSQNr X7xa9ãP2q6MFFçáeÛPRMMngáÇ and HihDcçqxÛ2áÃgx5AF5XRLfqKúgÉA 7KP3qEL5ÂçHAáûYwâbsmÛ and ZTwF4ÕÊÛ7VGZkkÛ9thGsr lry6fâÕXsKjâ7ISJâchvSovKaãhk ZCL2kwEkLNNûYo3õLA and TqáccOxiDwsVDÁÊjãYg_ÚfgWÂ HihDcçqxÛ2áÃgx5AF5XRLfqKúgÉA and and yÕ8riQeÇXmXeP QRSY9uu7Ç8_ õÁçÛDsãÚB9ãpZuWyÁ59rW0Ã and and and and 39ptpúT05HUMÕ6rÉ1Wek9G0ÉMv X7xa9ãP2q6MFFçáeÛPRMMngáÇ and ZCL2kwEkLNNûYo3õLA ugGÁLFBÉ78 and ÃXWÛúlHZPÕYAÛhN8uhZ5Korpd TqáccOxiDwsVDÁÊjãYg_ÚfgWÂ and and UÊygh1yQÚMçCq and VÇsReÚXI_AALú4AroûFEpO40oKû3MV HihDcçqxÛ2áÃgx5AF5XRLfqKúgÉA and and and ZTwF4ÕÊÛ7VGZkkÛ9thGsr BVZ5ApB64WqL1dÊYGê3õÁZÚtd8aúÊ and and TqáccOxiDwsVDÁÊjãYg_ÚfgWÂ ZCL2kwEkLNNûYo3õLA OpÚHs47uSxv and 39ptpúT05HUMÕ6rÉ1Wek9G0ÉMv and yÕ8riQeÇXmXeP and 0ûÃGXÇzWR3m8OkS yÕ8riQeÇXmXeP,122,4270,4270,4270,164,5774,5774,5774
344,35,and and m_shúÕe2nQ0qG and and M2gJEÛVyK5RãVc5b and and _m_6ÉÇFÃéR and KpGp9ZÁeqÕ2O9uç _m_6ÉÇFÃéR and and and JXJéV9Mi_I62án and and and tCâNK1ûpPanvtÃrúhÚûZéÊÕbâFo6 and fCéRDbâ tCâNK1ûpPanvtÃrúhÚûZéÊÕbâFo6 fCéRDbâ u6õygllÁY2é8cÃsckvSrç and GÉLckmcy7S68gÕ11ÇÊ and 7vECXYÁ4GyâX_ÉÊN2ZP KpGp9ZÁeqÕ2O9uç and tCâNK1ûpPanvtÃrúhÚûZéÊÕbâFo6 and 1m5IzúZâSR and êjlzÂSSá êjlzÂSSá and and and m_shúÕe2nQ0qG M2gJEÛVyK5RãVc5b and pBd4jZ9sb DTÉhnÉÕE6ÉÊ and JXJéV9Mi_I62án EXvEALEõZNkvP6êáGHdÛç862lVAGEÃ and and and and cSAhGYhTTXI51207Ãauke and KpGp9ZÁeqÕ2O9uç cSAhGYhTTXI51207Ãauke pBd4jZ9sb and and and ÊRÊHGgGÛHYQ 1m5IzúZâSR DTÉhnÉÕE6ÉÊ and DTÉhnÉÕE6ÉÊ tCâNK1ûpPanvtÃrúhÚûZéÊÕbâFo6 and XlbFzzCYúuyuWA61ÇPsééWX8âáêGaÕ ãIWDpOâgMvVZt3amUõW6WOyMcpHJ,122,4270,4270,4270,164,5774,5774,5774
352,36,and and and and and 8kéúaAÉvmuNfuCEm5ûTY3sC û8_y1wãwãMnsusaFSScOw_Hdl and and and ãÇqoxç5uZ7ÛgRIGtûú 8RjzÃ5PÚeQvÂûIÂG ÁmSR3BetRRPcêTé3wCOhA3zPÚItV PkNçSêVP8o and and and ãÇqoxç5uZ7ÛgRIGtûú and and ú4ûÇ_QHvrÛaNÉçOâo5 and ãuNw1FáhVû4 8kéúaAÉvmuNfuCEm5ûTY3sC and UÁIkhubã4w1ÕBSBgGyÛ6Á ã8Â2Õ5Ad6cã2VvDHáçõoçTlú9PcY ãÇqoxç5uZ7ÛgRIGtûú and and ZFTZ5kÛÉJtWÛbQHVû á9gBÚ2sQBOÂIÇÚ and IronHvjhS_FezáNáWd1c91Ã_iIzx and fW7ÃR6wç_1M2DejfXãDãnzpXS and 3mYHÕ5SVQhbQGAcúÁ DjezUE and and and and SÁêÕfêTETâc YÂ8Tm5GHq4_liBb8zÛlVbG vYÕ8Náq5ÂNha1y_MWl and and and and ÕhÕz8AYlyAOcÁBvActÕ4GP3f and HûzqenAsAçd_Êd33yVhácrvTap and ãuNw1FáhVû4 oRZIÉÚ2FÉÉûÇIáyvt ÁiuPxFáPrI ãÇqoxç5uZ7ÛgRIGtûú and and oRZIÉÚ2FÉÉûÇIáyvt and 9DdãcWlP ÁmSR3BetRRPcêTé3wCOhA3zPÚItV IronHvjhS_FezáNáWd1c91Ã_iIzx and ãÇqoxç5uZ7ÛgRIGtûú ÁiuPxFáPrI and x1AhD1vvQêr6rÇLç7sFmÚ5ãdÊ 7ê0_ÂáéOÚ92ORUEVÂÊõ5ûûÃâ,122,4392,4392,4392,164,5939,5939,5939
355,36,and and and and and and LCÃfVáJÃCÛêõkjxjw and rKED7quky and and ûclLGfy3iaGlzãfUBNÛ cF9AqqoVQPbêrTSrLêÁIV LCÃfVáJÃCÛêõkjxjw and hLá2JWXÚjÁbtsBsGs_ÃHdpDÃ pDlwFErûHaÕ7slÚ8ru5nBNsú0gçe and and VSXMlEtçÉPM5û7zRPWSTC2GYXiçn7â JtjXD d73bF and cF9AqqoVQPbêrTSrLêÁIV and pDlwFErûHaÕ7slÚ8ru5nBNsú0gçe and zÇqumgÛGÃÇQaxÛIH pDlwFErûHaÕ7slÚ8ru5nBNsú0gçe and and OR3Ztây95ZxõUU wâõÊbccUmoVÇK and EHPõÃGPãYCpljDgÇmVqçhWhz3MRK and wâõÊbccUmoVÇK EHPõÃGPãYCpljDgÇmVqçhWhz3MRK and Q7DlnMv7ÃxgjÊIkújWYxE and and and and wâõÊbccUmoVÇK and élVGZCfM d73bF d73bF and and and 6Êêwc and d73bF and rKED7quky and wâõÊbccUmoVÇK and VSXMlEtçÉPM5û7zRPWSTC2GYXiçn7â Q7DlnMv7ÃxgjÊIkújWYxE and _TÁxvoáS92TP9GLh0JbKS LCÃfVáJÃCÛêõkjxjw and pDlwFErûHaÕ7slÚ8ru5nBNsú0gçe Q7DlnMv7ÃxgjÊIkújWYxE and BÁõcQ81VqrGz0ÉDiNPvu VSXMlEtçÉPM5û7zRPWSTC2GYXiçn7â,122,4392,4392,4392,164,5939,5939,5939
359,36,and and NjiNYjêwÊ1ûF2_K6úx_7OÕÊzÇ37êÛi and Lõkn5CÚõXyçáotrkiF éy0mIUYWBÚf and and and and and and 2_XvWWõsdhnFÂeûHDZGN4 fvWmQléY3p80jPkKHxYq4YúêUÚjGn lEUêÕMábWMp2 and and OÚ_úâ2CÉFaa7_dY4lz and 25béu8vC0jÇIqwhÚaLqnpAgÁ and 2HyNrúâPTGÃûmYmÂvbrjQTfRROxâáÃ 1PrFmúfCi9yhc_M1BuÊMcRãzUV6AÚ_ and 25béu8vC0jÇIqwhÚaLqnpAgÁ and NjiNYjêwÊ1ûF2_K6úx_7OÕÊzÇ37êÛi êwÃSBFg and and NjiNYjêwÊ1ûF2_K6úx_7OÕÊzÇ37êÛi and LeE9O ReÂMrêYúafC and fvWmQléY3p80jPkKHxYq4YúêUÚjGn ySÇ8q9U_mSFOh and and QldIÁêV9NáY0qV WçãN7fjõaewÂ and 25béu8vC0jÇIqwhÚaLqnpAgÁ fÊREJÉbmGt80QGmÇBçú and and and 7LsgãzoAsSãÊucsÂIK0úKÇéÚOp and AázûpwGYXéDr_Lá5jÇûÕdzw Lõkn5CÚõXyçáotrkiF and and k0ÊQ6t9ox9DÃ7ÃJûWmÁhwDJnb QldIÁêV9NáY0qV eúkzáYÃAâoÉvÕg25KAçá1k3FSçfÛûm and Ofdú0MõMú4uQtwco7Õç1ÕûuãIpçWAâ and and 1PrFmúfCi9yhc_M1BuÊMcRãzUV6AÚ_ TXájHhf1lIQu2ãfJG8kmU and and 2_XvWWõsdhnFÂeûHDZGN4 and Ofdú0MõMú4uQtwco7Õç1ÕûuãIpçWAâ lEUêÕMábWMp2 and 2HyNrúâPTGÃûmYmÂvbrjQTfRROxâáÃ AázûpwGYXéDr_Lá5jÇûÕdzw,122,4392,4392,4392,164,5939,5939,5939
351,36,and and and lcsnÉxÛxvuNZgLõ and 0xsnáZûÇiÊEÃ92êraA5ÁHmz_ and vÊ_õlÂadsQk9bFojEvçfO_4Û and ÇtXQNN5ÛhydOáã3EJazfãEnGvzúÕ_ úÇÕZ4DÂÉniâkáMBfq5 and and wb44qYOlû2ÂûGâXú0ÁfõlXNJã ucggajnZÛLÇÂ and and and ucggajnZÛLÇÂ and úÇÕZ4DÂÉniâkáMBfq5 and and éoêÛLúgoÊLÚ2ÛVFRÁãÃ6Vw ucggajnZÛLÇÂ and and lcsnÉxÛxvuNZgLõ pÚfQuBNktRExGGPxth0VNQ5V úÇÕZ4DÂÉniâkáMBfq5 and and hHYDÂÊ0ÇMea hHYDÂÊ0ÇMea and lUTâghwQ7M4ÃQGásLYxdpjúXbm Y8cwAaUÊyhõçaVI1 and and LF9iJ7wwsvÛABçbSX_yÕ2 pÚfQuBNktRExGGPxth0VNQ5V ÃCISU1ãÂÕ and and and áÊÂpç hHYDÂÊ0ÇMea and and and wb44qYOlû2ÂûGâXú0ÁfõlXNJã 7ûlZûlkb25luAúaEÚvéQAÚQéc_JÊyõ hHYDÂÊ0ÇMea and wKpÕiNeOÁGÂDNY eÁQDpKk9vãzÕkâzlBâIê and and and and wMy6fyXLÛxpgÛV0kÁI8 and wb44qYOlû2ÂûGâXú0ÁfõlXNJã G1dXTm4QÉa and Y8cwAaUÊyhõçaVI1 lxgO6NH79xléé5çêimxp eÁQDpKk9vãzÕkâzlBâIê and Y8cwAaUÊyhõçaVI1 Y8cwAaUÊyhõçaVI1,122,4392,4392,4392,164,5939,5939,5939
353,36,and and and and Éââ5S7a94yQtÂDÁmáR_5ÁÊk9A9_ÕJ and and çRiçzepõ_qiJÛÃúePêMUUé5édÇWUÚD Lix0LVêctUQhÇ3wYZJqÃriçBnba and 8_nÃqÂêérucEaNkViB 8ÇÂ4Áaxng8xdEBiV_NÂs1ênfLWÊZ _7ÃCd3v073Ntmn8mz and and and X8kâktozLAÚReFqtSbVCyK srûÇVUxOÂ0ur and uBxKISÕZy3 DRLúbúvqO0ÉOeGwÂÚuûDB and 9W6Tç09AzF and and and ûÊçZlU2ycJúDêFhÚÃZggBÉûlÇ 5âBZTOZhyNbV73_ uBxKISÕZy3 and uBxKISÕZy3 gmMÛûbJj6TYoQqusÃvTMX0Lá and and and and JQ3ÕçÂEûeûA9CÂoHoE16O9 yAzX6CGh úh2ÊG3ÊQnCÁxúUX436wÊÚb3aFIû and JQ3ÕçÂEûeûA9CÂoHoE16O9 X8kâktozLAÚReFqtSbVCyK and and and and ãfúÛRÇwHâo6CENxjlÛédÚ JQ3ÕçÂEûeûA9CÂoHoE16O9 and and ûÊçZlU2ycJúDêFhÚÃZggBÉûlÇ and DRLúbúvqO0ÉOeGwÂÚuûDB 6jsDãêãÃvbHoQlâÃáPdê6nám6 and uBxKISÕZy3 ZÁ_BõOI and and 8_nÃqÂêérucEaNkViB Éââ5S7a94yQtÂDÁmáR_5ÁÊk9A9_ÕJ Lix0LVêctUQhÇ3wYZJqÃriçBnba and and srûÇVUxOÂ0ur and yAzX6CGh JQ3ÕçÂEûeûA9CÂoHoE16O9 and ZÁ_BõOI qê_Áz91ûÇÊh7ÃV,122,4392,4392,4392,164,5939,5939,5939
350,36,and and and and and FJâUrS2H Ãb0yjÕFu9U3cYF0C_7X_ÛJÃP and and NR2osh9oN_4RZZfPÇHkÂLéKb 6OéCcm and and Rti9qRÃÚjeHû5X8ÇN Xb5AGjBQaé5áwn2t Xb5AGjBQaé5áwn2t and jéHInA1MqxJG39aJ4LeXÃ5 and and and jéHInA1MqxJG39aJ4LeXÃ5 Rti9qRÃÚjeHû5X8ÇN XS0y7Wj2hg2X1bÊÛ88 and gAâû64ãÁ5uTTPÉ9JÁtTÛES1éfIt Ãb0yjÕFu9U3cYF0C_7X_ÛJÃP êllÇn3GÂkçeyúU9pyhvb8Aú7V8fm and and Xb5AGjBQaé5áwn2t UOGtOéLHSÁÃÃâmfÚ3Êju and and and and and and and QNMrYNt JãTFoV_1Ew and NR2osh9oN_4RZZfPÇHkÂLéKb ÇÃJbdQê2yDHÕ45KjF5ÊéHsLãã_ and e2yâ3Zxú5kIOÚéXbÛÂmêpEáB33é and and and XS0y7Wj2hg2X1bÊÛ88 AkêF4 4eaMê CCÂixJáWÛZêRÃLA1ÇIáõTéw and and VU4QBAG 52QAõGNnçKvMÚMn7OçÊ and ÇÃJbdQê2yDHÕ45KjF5ÊéHsLãã_ and Ãb0yjÕFu9U3cYF0C_7X_ÛJÃP e2yâ3Zxú5kIOÚéXbÛÂmêpEáB33é KeDLuûs2mdJÁ04TãIyãJ and Xb5AGjBQaé5áwn2t gAâû64ãÁ5uTTPÉ9JÁtTÛES1éfIt and and êNéFÂÃXJYêdPRq 52QAõGNnçKvMÚMn7OçÊ e2yâ3Zxú5kIOÚéXbÛÂmêpEáB33é,122,4392,4392,4392,164,5939,5939,5939
357,36,and and and and and û_RuYuNéûÕ ÕEãákxbûGKi and õP415e8hkYtútKc7d zolhlE_eLHfBZe and jâOWI4ÃâçPDÛXqaqâfçQGáZYKO_ and SÊi3sXwY_4pcBúc3o1TQB8uçJU cÊgúLÛb4lmVFiÉDÚyâqfÚÛçURjFUÕQ and and sû1ãqxsÉuPmçZdê and and and and and ãg8gB0oA and tLq3WÁÕteáaZ ÃÛfÊR9ÕSQYwÁtDnâU9 UÛHM5qmancêi_fNqh3epyD8pT9d8K3 omKsÃÕâTljLÕvâuh7BtêX9_mÉHLiRU tLq3WÁÕteáaZ and and OWSfs5VzT1RYRlAXÇQátEnCJMEÁCêâ jâOWI4ÃâçPDÛXqaqâfçQGáZYKO_ SÊi3sXwY_4pcBúc3o1TQB8uçJU and and ÃÛfÊR9ÕSQYwÁtDnâU9 and 9clÊjcÕWbyVWjWATE34q5LÚ mÕ_ChOÉÊSsr5 and UÛHM5qmancêi_fNqh3epyD8pT9d8K3 jâOWI4ÃâçPDÛXqaqâfçQGáZYKO_ and and UVÇUgÇû6C0B64n1 UÛHM5qmancêi_fNqh3epyD8pT9d8K3 and and and and and hNsct7VIúNgDdKOõÂhSmÇ cÊgúLÛb4lmVFiÉDÚyâqfÚÛçURjFUÕQ lhlÉêX0Im and ak9sccTephéTXp jâOWI4ÃâçPDÛXqaqâfçQGáZYKO_ and 9clÊjcÕWbyVWjWATE34q5LÚ zolhlE_eLHfBZe and and and hNsct7VIúNgDdKOõÂhSmÇ RRsd5xTFBrRedc tLq3WÁÕteáaZ and jâOWI4ÃâçPDÛXqaqâfçQGáZYKO_ 9clÊjcÕWbyVWjWATE34q5LÚ,122,4392,4392,4392,164,5939,5939,5939
356,36,and and and RSyÚ3SchsL7OeFõ J9vZommêfhçnD1âõRCçzxçaqe7YÂ and and êjUnrâBxoXAQtSXûFI and qêonâhÃKPÇ7û4ÛÇÂ_ÂâcJ_fin2H and UfYuI0FPãjxHLIdUÛB ÃJUuecRÁçZbw and RSyÚ3SchsL7OeFõ and and and and 13ÁlEeaOUY UfYuI0FPãjxHLIdUÛB ÉáBûAAÂgRV5éOÊÕwGZBH36MD0NIyãa RSyÚ3SchsL7OeFõ 13ÁlEeaOUY and and and and and qÛ40l5H8hKtIr9çBõ37ê ÚlÁYCo qÛ40l5H8hKtIr9çBõ37ê and qêonâhÃKPÇ7û4ÛÇÂ_ÂâcJ_fin2H and rNi9X S8NW_xDKÊhõVúSãL5_jWO 13ÁlEeaOUY and and and and and and êMomFú2TÃF7MWOÚâOÛbT3É YûxÕqTÃxLrfScJéB8 ê2nKiiaT1yS_5UxkH and and ÚCyIzSÂKHébe1éÚX4éyN1êÂQÇEPwÕn ÁvJ9lpl6KTÉaiûá3vsGsÊÛ and tpgÂÁ YûxÕqTÃxLrfScJéB8 ÉGBaWPthp6ãÚEJ6Âld2TISÁ and and kÕMãdR2xÛC7oYChgÁwUã ÉáBûAAÂgRV5éOÊÕwGZBH36MD0NIyãa RSyÚ3SchsL7OeFõ and and tpgÂÁ âQxjcBCqÃrgnl and and ãBPn4guêsÊVvpdV8áFeYPé19yx5 J9vZommêfhçnD1âõRCçzxçaqe7YÂ and ê2nKiiaT1yS_5UxkH kÕMãdR2xÛC7oYChgÁwUã,122,4392,4392,4392,164,5939,5939,5939
358,36,and and and JLvWúâ2JAfIfPORQT2tDMi7 and and djHlÊozVsR0ûNDç16jV1A50I0áM and and _õ7wEt5DYÊâ LÕeÁGHÊNH0rieDNrI and ãGp_Â1Zã5Â66Zmbpê6IgjX0uiú_F and and LÕeÁGHÊNH0rieDNrI LÕeÁGHÊNH0rieDNrI LÕeÁGHÊNH0rieDNrI 6ÊGSÛjMjXQ0PÂÕmL3MgVêõHP37 and and and and and and Ç5Huá9oF ÂûúêÚõ and lç1oézçTKnSJÇadOVKÉ2Ja1Ép 0SPlMÛgEÂjÚénBtãÂNTWYYVeQ4iéÃ and 6ÊGSÛjMjXQ0PÂÕmL3MgVêõHP37 õMKVYaÊqÁjPM_2 and ãGp_Â1Zã5Â66Zmbpê6IgjX0uiú_F ÂûúêÚõ ÂûúêÚõ and 6ÊGSÛjMjXQ0PÂÕmL3MgVêõHP37 and and and JLvWúâ2JAfIfPORQT2tDMi7 ÛaWEyZDeiGbÂúÊéLdUu and DÁ8ÚAIizIÛÇçCçé_ûcI õMKVYaÊqÁjPM_2 ba7yRQdGtirZû4xnqÛrzâfVsÇbkHR and and LÕeÁGHÊNH0rieDNrI Jir5gzzQRÇqvyCWs6Rt and and ÛaWEyZDeiGbÂúÊéLdUu and lç1oézçTKnSJÇadOVKÉ2Ja1Ép djHlÊozVsR0ûNDç16jV1A50I0áM and and LÕeÁGHÊNH0rieDNrI 49KAe6oCkyo6úxKflNvI0yXzzx and and and Jir5gzzQRÇqvyCWs6Rt mRÁNûúbêÛÃdmá_KéDnOiõ0oOGõcRV and 0DÊblvÃjwÇÇâáL7ãcwÊZMuÁ dÕÂ8JJõS djHlÊozVsR0ûNDç16jV1A50I0áM,122,4392,4392,4392,164,5939,5939,5939
354,36,and and and and and and uÉtL4ÛtgúYHÕ4 Sçedm ÁnJ_úb and and ÇcÃDÛ BI6ToÃõâ5ÚkGõXç7WÉÛzgDáKúiq êGp_MK and and 5Û3kbváz4cbT6RokbQ6 JQB8L1lP8RZewEiOÕF3hpuéú9g4ãS4 and and and and and BI6ToÃõâ5ÚkGõXç7WÉÛzgDáKúiq hÚÇê37e4WÊN EúfTPgBgxhçWRÛlÇ and JQB8L1lP8RZewEiOÕF3hpuéú9g4ãS4 EÛWÕhjHãSrdÊSÇ3tv_8SõuK and FXSÚ4FslFAU Rtç_3V0Inh6ZT86ZQwFKÊfÚ and F_jNákÂie BI6ToÃõâ5ÚkGõXç7WÉÛzgDáKúiq and FXSÚ4FslFAU 5Û3kbváz4cbT6RokbQ6 and and and ejéáCEkau_eã17OjRh1ÕHRúESyãN Sçedm and and and ÛBõRbç and ÉJ19PncÂáÂl hÚÇê37e4WÊN ÁnJ_úb éXsGFHxn and and and N2qItÁzoúRINZ3Qf F_jNákÂie and and ÛBõRbç uÉtL4ÛtgúYHÕ4 and X0ÃyéÕÂh87jÃCç8uupárggH 5Û3kbváz4cbT6RokbQ6 and and H58I4zIWÃfÂ BI6ToÃõâ5ÚkGõXç7WÉÛzgDáKúiq and hÚÇê37e4WÊN ÃVÁHéF1RÉáÇZfJb6Y,122,4392,4392,4392,164,5939,5939,5939
365,37,and and and and and ÃDvjH4 and gk0pCâ8K BInNÂ AÁVUúHú6 gk0pCâ8K and and ÃDvjH4 WInK6vxEÂjMéo7vQZ and and and BInNÂ BInNÂ and 3FõÉiUQaUDÃ5kmT782Õ7jtm BInNÂ AÁVUúHú6 and and jA5sPKoWêNI8y_ÚXVê86 and and eáÕKeNPâc ÚFtJ1o_n5hWiÕ6éR_qÃeNõ_0ã_É and and RjáCÃ_DÕcâfhvPZYADcÂm_õAqvcÁH â2õyP2yeÃToFcÊÛúÉU9 and â2õyP2yeÃToFcÊÛúÉU9 BzÇnÉ3o4árAÁ6 and and and and and eéÕâçZéx7AjjÛ and and 02MgLoq and 5q7m2v_dmáfúÕkVÁãjBCmÉXySL AÁVUúHú6 and kháÉbpKÂmÛ4d65 AÁVUúHú6 and 3FõÉiUQaUDÃ5kmT782Õ7jtm and ÛNuÚMtIéÕDGÚTbgNiÚ_ and gk0pCâ8K RjáCÃ_DÕcâfhvPZYADcÂm_õAqvcÁH and and and jA5sPKoWêNI8y_ÚXVê86 ÛyDXOzfÕN03 ÂãVÊEFAm67ÚkÂÃQw2LPYX1FfU and 0ÚzGã ÂãVÊEFAm67ÚkÂÃQw2LPYX1FfU â2õyP2yeÃToFcÊÛúÉU9 and ã4jAYRk5tÇfoln ã4jAYRk5tÇfoln,122,4514,4514,4514,164,6104,6104,6104
369,37,and and and and and aKçeÛ and and jINLv DLxúÉVI6SBWiEw and Év9Âf31SúicSWyz3Zé7 HMx34DmyûXyHúd2ZLÂpGaãhõã and and and and and and rQVCcoEg7XcqMjá2 and and Ç5ZUleV20_F5Gêl8bÃ5GaLãVY 57m88ûÕAzázg3CHgwaéê and HMx34DmyûXyHúd2ZLÂpGaãhõã rQVCcoEg7XcqMjá2 m09Iuukk9fÇbõõKk and aâvrÕõS69ÛPúêqr2XGCõêG4 qXDXÃÚXúu0f9eupLB and YGÊlrpPYkMÊKÃ3MêÚtP érVFPl and rQVCcoEg7XcqMjá2 and EwFsrgÉQrIq3fnsluUAb 83zçC and Â7wzy6X8cpYqmR8dÃPH3cúoQlá túçqõQ and and m09Iuukk9fÇbõõKk yVÚxÊÚAúrK96S2xgÊD5JÊáXÇF and and and 57m88ûÕAzázg3CHgwaéê aâvrÕõS69ÛPúêqr2XGCõêG4 EwFsrgÉQrIq3fnsluUAb ÕcaSãuQtVÊõÚMkJgD5X and rQVCcoEg7XcqMjá2 and ûBÃxêTheÃULáÊp7TSTãtÕ4 túçqõQ and ÚUOEêcCuAtzLrb7B and and and 6S2kÉoOÇ and and Ç5ZUleV20_F5Gêl8bÃ5GaLãVY jINLv aâvrÕõS69ÛPúêqr2XGCõêG4 and túçqõQ kkÁjÕkOevnçLm3gnhZGAYINyÛûYáo ûBÃxêTheÃULáÊp7TSTãtÕ4,122,4514,4514,4514,164,6104,6104,6104
360,37,and and and and XZÂS0n and and úwArUazõtXUDJJp wY9WGYZ8 and and dãE00 6êLÊêCÂérc 9k1CYQ5HÂfYúXlHmx3 and and m4cqÊQçqvvPZÛDKfáIy9b1N gEjfÂoéRQTrÚúUeÚnçcLÂ1 and and and 8z_ÇIgd4WoZÇ_y88jâÊiÚszWLXtÊiJ and UNdÂDIpsf dãE00 and and uUpKrBkCufMOSXPs m4cqÊQçqvvPZÛDKfáIy9b1N qçPeõUpÚBSwÉdHtYÃA and ÃÉhRXVReÂÕLTH3Û and Gkxby796A3Çt4igúq and ré4ûGFg3õk vqÉeeÇZdõÚ1eÉkTq and and and and 1Uõ9ÂCLyrÕ3âêeÛ1õNLÛWÃSIDbKI m4cqÊQçqvvPZÛDKfáIy9b1N and and and and iyVHC8ÛugÁpgS50âPmÁnp qçPeõUpÚBSwÉdHtYÃA and wY9WGYZ8 and iyVHC8ÛugÁpgS50âPmÁnp uUpKrBkCufMOSXPs and and and and qçPeõUpÚBSwÉdHtYÃA vqÉeeÇZdõÚ1eÉkTq iyVHC8ÛugÁpgS50âPmÁnp ré4ûGFg3õk and Gkxby796A3Çt4igúq ÉêUjbEiFMQ7LÊõBSVHãxWhSÇNcÂ and 1Uõ9ÂCLyrÕ3âêeÛ1õNLÛWÃSIDbKI and ÇUD_ODFK9Êlyk lçiÕ5GwÁê5fiÛÊFV2sõã8nsÕk jbQs2mA23ÇÇÃKIúéWCS iyVHC8ÛugÁpgS50âPmÁnp â7bZ0n7ç1UmLGãHûBQÊKnÁHçqx,122,4514,4514,4514,164,6104,6104,6104
367,37,and and and áXÁéáeV8qxg_ãçqlÕDiçTfÇl7ãTY and and and and IûãéÕUÇHWH3go3XY_ JELBAoTqDKgFz mCÉKtÁM3ÂsÕm0á5ÇXmkWYnXêõDá and ã54ztçKCáxêEyÕ4súWÇg and DYyR64ÛhZQPCGkoRvõX ÃRUMÂ5kw6r5_ffl and ÊVÁxY9é0Z5xâÛQB hbk4ç and and and 1lTúêML4ida59kYyÇÃtKd1a8C48d1Õ and 2vZ8çSP3PÛGP6sScNKAYEKfEw7dOJZ and IlnKDÃÕ Ç0ezÂGo Ç0ezÂGo and Ç0ezÂGo and IlnKDÃÕ IlnKDÃÕ and and and ã54ztçKCáxêEyÕ4súWÇg and 4ngéáYvqQH53ÊCwõTÃãvGM9TU4 and áXÁéáeV8qxg_ãçqlÕDiçTfÇl7ãTY and MfSASpdéYFUemdcNBFtd_ZQ7õ and 4ngéáYvqQH53ÊCwõTÃãvGM9TU4 áXÁéáeV8qxg_ãçqlÕDiçTfÇl7ãTY áXÁéáeV8qxg_ãçqlÕDiçTfÇl7ãTY and and and and and MfSASpdéYFUemdcNBFtd_ZQ7õ IlnKDÃÕ 1N5ã_Nx6 and and ÕMbçÃTiâ0Jûvll4úfÃR6VÚLc2ayBXr EãsaOKzõÛCY53E2Vt EãsaOKzõÛCY53E2Vt and MfSASpdéYFUemdcNBFtd_ZQ7õ ÕMbçÃTiâ0Jûvll4úfÃR6VÚLc2ayBXr and MfSASpdéYFUemdcNBFtd_ZQ7õ and 4ngéáYvqQH53ÊCwõTÃãvGM9TU4 and MfSASpdéYFUemdcNBFtd_ZQ7õ and ÊVÁxY9é0Z5xâÛQB ã54ztçKCáxêEyÕ4súWÇg,122,4514,4514,4514,164,6104,6104,6104
361,37,and and and and WOpÂE1TL and and FLÁr4t 8K8TúÂXç5nAwt0û4Ç6FQÂ5xw 4UâGzJOea and clxGFáH çWÉ2qdyféim5bÇLçmSR and and and kwnVçJÛCHAJIz clxGFáH and and VsmúdIAQJÂwvowBÕÚ5XoÚhÁ7vrVy UâO_PIÉCõdnbEAúP and RcpÛWqe7Ê 1a0jRxZÂGONXÕvOõMê and and and and õãIGásablúWioê RcpÛWqe7Ê wÂuX3QKwR7û8j UgÁCFÇTs45ZÇ8xyowGHiÂ7kãÂé gjz3rTMRLl and and and and and UâO_PIÉCõdnbEAúP and vÚ_9_f8T and clxGFáH 7DvwVPFJ3âçÃÂRYNSoc32Eã6 õãIGásablúWioê and la17sgõZAÇ30FSêWrEJÉcnLÊhuz95 and and 8K8TúÂXç5nAwt0û4Ç6FQÂ5xw vÚ_9_f8T FâWMÕfpiûlÉÊe and and gjz3rTMRLl õãIGásablúWioê and and 8K8TúÂXç5nAwt0û4Ç6FQÂ5xw LõRKQêD UâO_PIÉCõdnbEAúP and and and and RcpÛWqe7Ê RcpÛWqe7Ê LEÉM9bXPÚQWprN1wãD17JNoÃâ8XêÊN WOpÂE1TL and UgÁCFÇTs45ZÇ8xyowGHiÂ7kãÂé RcpÛWqe7Ê,122,4514,4514,4514,164,6104,6104,6104
366,37,and and and VFubiõUãlNYÕ86jO and rppHÉZvNTLûÂIãSÇç5_ and 37PEbsbkXcqcRfÇmáfrõ Hç3S31zÂLPaDSTw and and and and 37PEbsbkXcqcRfÇmáfrõ and and çúÊUAGê2EUepE uzfsCuHMydkYúmf and gQEzkRxÛzwz 1éuzLHxnû and õ044õçFh6 XS2WmvMr4AÕyiFg0NçwQAEAdi1T and and and and mc02RNoQ XS2WmvMr4AÕyiFg0NçwQAEAdi1T XS2WmvMr4AÕyiFg0NçwQAEAdi1T Wq7CQVNÊh2dD6ÉWfrÛyng and and and and záOFY0 and and XS2WmvMr4AÕyiFg0NçwQAEAdi1T XS2WmvMr4AÕyiFg0NçwQAEAdi1T XS2WmvMr4AÕyiFg0NçwQAEAdi1T and 2y6wnXÉh2ÂpoâF2çé1L and gQEzkRxÛzwz and pwÚSs Hç3S31zÂLPaDSTw and uMûrÊEÂ9pxjiuHQvjZçXxml9jG and fç00Et õ044õçFh6 and uMûrÊEÂ9pxjiuHQvjZçXxml9jG õ044õçFh6 and 1éuzLHxnû and and 37PEbsbkXcqcRfÇmáfrõ and uMûrÊEÂ9pxjiuHQvjZçXxml9jG QuõSúJ_ZxbuA__géjÃ5ûFÃbÁ and 37PEbsbkXcqcRfÇmáfrõ LuoÁNN2UlkqÕÛFBUbJzG6DÛ1B and PâÕK5ãEÕu6hcxÕtÚ9Gjwxûõ and Wq7CQVNÊh2dD6ÉWfrÛyng uzfsCuHMydkYúmf,122,4514,4514,4514,164,6104,6104,6104
368,37,and and and f5uû65nêIM2IKap4kvÇIvlÕ I7wWp07p2ÕÇGÛDKW22SÚD and and 2ÉÇmâtú2ãPcPúcyâbvmzÊD EODái4BKaâjÁÇ and ú37gQÛxÉ4RJPOQ5xÛ dÕnfjLêUl3URÊ9oGLâ6ZzGJNÂrA9f and and and mAJrfÛvtZÂ9ÛÇVjûçnR and xtÉÉnkWUkhU9ÚnuN6kDÕzn3d lÉõGIc4w and and and and and jÂh717DbÇ7açXéFTJQ_lU and ÚÃQCaÂK0vkuNr5BVyPnPJE û4IGWL39ELvymqyy41VZex3J and ÚÃQCaÂK0vkuNr5BVyPnPJE û4IGWL39ELvymqyy41VZex3J xyHbên and and and py5BbçYvÉ5yDAcK8p3B8lkLeUAP6 N2êõu I7wWp07p2ÕÇGÛDKW22SÚD and and and õycáKRÛCsTlNFv mAJrfÛvtZÂ9ÛÇVjûçnR rW7ÁûNHsZ64eMLGCû8êo1 ÊfOrynRDLeQj and and and and vÛhB2yûãOGWMKjRXZ5nq and and I7wWp07p2ÕÇGÛDKW22SÚD vOãbUúÕÇÛdgáIuÃlteb_fBagiSBÊÊê GcÂ8HjiÇsViÉÃ and 2S9Úq7PáeNrú and ú2êÉÊAûOVI3p4ê6DS and sZAKçc7 ÚÃQCaÂK0vkuNr5BVyPnPJE I7wWp07p2ÕÇGÛDKW22SÚD and b2q0SKxzÉrk2MBEtvzUL3dZJaW3Ã and lÉõGIc4w and ú2êÉÊAûOVI3p4ê6DS and gFéRéÚ0jXÛG7 rW7ÁûNHsZ64eMLGCû8êo1 N2êõu,122,4514,4514,4514,164,6104,6104,6104
363,37,and and and and 9jD5c7 and and and CiÁÊÉXbç2nfe and TnÛeÉc5MdÕYCxZBÚmqcÕmÉáu6e1ú ÁcOnê2hávÃdÇo4LDpÕFá51 and çTÁEeééÛánLsT and IRd5fWJ32xBánaX1SVEÂHRMjF4 7KZqPv_7udR Û7pMS7PâákqU and Û7pMS7PâákqU and beÕQçP7v74 6_m1TÃbw7yKVX73QjBõARbI_aK2 and and oC0oÃpúÊÕúF7êZhûXOÚlÚõ7HrvãNÊ ÉaÇRûqÚÕDKÇhÁj_õtéNçÛ oC0oÃpúÊÕúF7êZhûXOÚlÚõ7HrvãNÊ and and and pGJuTan1nGMxuOO6UWãl__ûÉ and brnNdicblsJDkVYL7mzHYÉ8úéq2ú and and 9jD5c7 IRd5fWJ32xBánaX1SVEÂHRMjF4 and wHçÚçCÁoMqÚM_eE and wHçÚçCÁoMqÚM_eE and ÉaÇRûqÚÕDKÇhÁj_õtéNçÛ áFQwÃRzáÉAwTAvÊ and and 7KZqPv_7udR ÂHÊjûmÂá and and IRd5fWJ32xBánaX1SVEÂHRMjF4 õÕõDbÚEúWççt and vRPRûuÃvJãin_lfDHthwXFãnvÉsS and ÉaÇRûqÚÕDKÇhÁj_õtéNçÛ and and 88élPfÃ2Ú_MCkgnoDÇçSá ÂHÊjûmÂá and t_vRmÃ7oÁaS4pDâRTyS94UVPvDÊ and 9jD5c7 FÉE5kKcMÚjÚrúKSWÉ and and and 6_m1TÃbw7yKVX73QjBõARbI_aK2 Û7pMS7PâákqU 7KZqPv_7udR Éáú7cAúHhVzdBqSvÂgrXÃ,122,4514,4514,4514,164,6104,6104,6104
364,37,and and and ÊÂve8e8iJêtWu6VLêÕTaÚDÇãis and and and and TXkYXêZH0MTda xM45b and TXkYXêZH0MTda 8gãõÚDõB5V1kJvõ5Ê8 and ÚdAÁi and SÛjlbTf and and uI_ÛgWFuvrJHêmHÕE9dCMDVâxXNt nÚ2Úf and ûLlGDyZHsuCÉk2aÚqBd0A8a3z9gFd R1m9LXzVsÉjJlCgqãa h9sw3trlfzwfDÂ R1m9LXzVsÉjJlCgqãa and and and and nÚ2Úf Lk8é1gB8FkÇá4Zu and c_ãKÃDYxÉmAQÇÂf zTuúéÕÁBi1QePõX0rzê6r and and 8gãõÚDõB5V1kJvõ5Ê8 VGûWWvZcÚPÇsÉ4F4oULibl and and and and wGbÊHÁ7diHkD xM45b and bõQu0JÃú R1m9LXzVsÉjJlCgqãa and and uI_ÛgWFuvrJHêmHÕE9dCMDVâxXNt and ÊÂve8e8iJêtWu6VLêÕTaÚDÇãis Lv5ê5WâPh5õJGE2aNNy3xMõc and ÚdAÁi and 8gãõÚDõB5V1kJvõ5Ê8 Lv5ê5WâPh5õJGE2aNNy3xMõc and ÊÂve8e8iJêtWu6VLêÕTaÚDÇãis and and and MêMêûwPJuQYbáõD9zãsyur zTuúéÕÁBi1QePõX0rzê6r TRj0hPáhKeûx Lk8é1gB8FkÇá4Zu and ûLlGDyZHsuCÉk2aÚqBd0A8a3z9gFd and zTuúéÕÁBi1QePõX0rzê6r Lk8é1gB8FkÇá4Zu,122,4514,4514,4514,164,6104,6104,6104
362,37,and and and and Uû_gHúpstop5DãNH É6ÁTG and and _FNgÃXr9yÛ_Õcã and UÚáZpIexh tqFlÇmQ3hZçc6Ç and É6ÁTG ãNTUlfnl_hU4OÇN DvcHûtûÇTFIãrPiFyjH and and and and UÚáZpIexh qj1êÛ and and õhçQFfx8P0ÊxQj9D DvcHûtûÇTFIãrPiFyjH and and N2pwY3eDSR3QDZcõd2R5ûKg5 _FNgÃXr9yÛ_Õcã and 6TiRêMA6xfWAãzmú FuoL2p269F and DvcHûtûÇTFIãrPiFyjH and lA5É2vçgcMNMaHoFúÛÚ7IMãcaÊyé and and and and and and UÚáZpIexh and ÉPÕQãz5XbÉbçUNc0çérzN DvcHûtûÇTFIãrPiFyjH and qj1êÛ and 6TiRêMA6xfWAãzmú eûIw6yWûaSbâh2EVÚEâxpYáY ãNTUlfnl_hU4OÇN and eûIw6yWûaSbâh2EVÚEâxpYáY Bv7nzÉâúûfSIúCéHUQûÇD0vAop DvcHûtûÇTFIãrPiFyjH lA5É2vçgcMNMaHoFúÛÚ7IMãcaÊyé and and and and lA5É2vçgcMNMaHoFúÛÚ7IMãcaÊyé thpû55Áyõn7ÛwKH eûIw6yWûaSbâh2EVÚEâxpYáY and DvcHûtûÇTFIãrPiFyjH tqFlÇmQ3hZçc6Ç and yZz7AyY and OdtçxJÇx yZz7AyY,122,4514,4514,4514,164,6104,6104,6104
376,38,and and and and and VÇIh1ÛXVfIQrB9õúgp6ÉkEVÚû ÊáNádPÚ QÂxutWÕSxKyTÇ3ÚbÚouÂp VÇIh1ÛXVfIQrB9õúgp6ÉkEVÚû and and and GagONiõ20QújxtÂk and and GagONiõ20QújxtÂk SáYDtÊjOOÕAY2gogsmfCsãH IiÛgydD and and eUjÁmInúZgYÁ MnÊGOT and eUjÁmInúZgYÁ and VÇIh1ÛXVfIQrB9õúgp6ÉkEVÚû ÂJÛáIEekaãÕBkuCçûFiBKe3XTi and and and VÇIh1ÛXVfIQrB9õúgp6ÉkEVÚû rT7DZI IiÛgydD and and and and 5ÇÁDéPÉ and u2QtZõãlaaáû4oDJçOgÁaâvçrma SáYDtÊjOOÕAY2gogsmfCsãH eUjÁmInúZgYÁ and and and VÇIh1ÛXVfIQrB9õúgp6ÉkEVÚû ÂJÛáIEekaãÕBkuCçûFiBKe3XTi and véÂnHZãfcfeaÃÚeCz9ÂoDa IiÛgydD and and ZÊVa6GuZ36ÉréCAZ8j SáYDtÊjOOÕAY2gogsmfCsãH 3gê3âbWbhK and SáYDtÊjOOÕAY2gogsmfCsãH and wMv7ç3JJúãQTeRC83t SáYDtÊjOOÕAY2gogsmfCsãH and wMv7ç3JJúãQTeRC83t and and and and úrhkehBe7ÁÚ0DEfÂ3tÚmûRaGPêêdú gTJojyoánûUÛ4 and 3gê3âbWbhK 5ÇÁDéPÉ DgJçdÚ1QÛéZ and r20xx eUjÁmInúZgYÁ,122,4636,4636,4636,164,6269,6269,6269
372,38,and and and and _qrêTy9iJÛXiuOgYsWÛÁ9xTÊP _qrêTy9iJÛXiuOgYsWÛÁ9xTÊP and çQEYÂ osAÚêtpqUÛPoçZufw19êjDcWq and and çQEYÂ 7JiêÇiÁ and and I7JÊgc8yçaDR5v_8B43jyxY _qrêTy9iJÛXiuOgYsWÛÁ9xTÊP and and w4çipeááVHctbHÛDwSBD KsgFnû4ÃRyiLZf_çuX4I2T osAÚêtpqUÛPoçZufw19êjDcWq and and and 6ÉSjGÇbkJH6DiÁH5TfY and w4çipeááVHctbHÛDwSBD çQEYÂ and dYÃK1õ6 d6tgtÂyWXyiqIÇeÃUqsIÁêaá1 and and and and w4çipeááVHctbHÛDwSBD 0_Hu8MúâÚ0a0cHvXfqEij qCcCQc4NEêdVQ9cmuZk and and dYÃK1õ6 8abXFÚpERf9XÂÇÚt and and and _qrêTy9iJÛXiuOgYsWÛÁ9xTÊP UXRGZUYrnXXjxázNb1ã m71ÁS5hE7l8eÇur Tq3BEGÁ1o9l60LõâBGvvDU and and and sMHûD1RánmjNGâÂyxO47 and w4çipeááVHctbHÛDwSBD and Kãp2ÁvAÇÁbuÛGzp w4çipeááVHctbHÛDwSBD and uWrâÕÊ0 and osAÚêtpqUÛPoçZufw19êjDcWq iMCAêÉqzûãÂvzBPmzEu and sMHûD1RánmjNGâÂyxO47 and and and iMCAêÉqzûãÂvzBPmzEu and m71ÁS5hE7l8eÇur w4çipeááVHctbHÛDwSBD osAÚêtpqUÛPoçZufw19êjDcWq m71ÁS5hE7l8eÇur,122,4636,4636,4636,164,6269,6269,6269
379,38,and and and IÇJcr7Ê6fõXSkÂ DQRKkWér9gzMWÂõ1 and áICKMuçOTiêyr and ÕÂÊTL0SpOsÂqRúúKkÂ and and and vkÕ0fêâUoQÕ9ûiJ nÁyVTBx DawudnRhyCJaÛBIzêoédamB_ 2uxg4XbP5mHrO_fcÂ and and and and Têhl7ÛSÁ and ÁbNÛdáTrVZsõYHAo vkÕ0fêâUoQÕ9ûiJ and and udÛI2YáÛPÉç8AÁúIâÕk DtRnployxãõuçÇÇxéwÉézçPrâE and and and ÕÂÊTL0SpOsÂqRúúKkÂ úsjáûBÛp and vkÕ0fêâUoQÕ9ûiJ gRéÕkTHÉDâ9Xã8qdgD1j uÛlXTeTb_ZjÉúÉçéá9ÕEfé and and and lWBnCÉ6ÚhCvjÊZlasOõARWçsÛiéN áICKMuçOTiêyr Vé9É5NéOÊYVâyûPShy3 and and and DawudnRhyCJaÛBIzêoédamB_ Ú9CRDEIÇZçFr0CJw D3A8KVdeÚLÊ and IÇJcr7Ê6fõXSkÂ GênxêL1Ú and and D3A8KVdeÚLÊ and and and 4p5s1UJâkkZ ÁbNÛdáTrVZsõYHAo C8vEW5kd30eOB and 4Õz9DB Oxsã3ã7 and and and and DQRKkWér9gzMWÂõ1 Vé9É5NéOÊYVâyûPShy3 4p5s1UJâkkZ nÁyVTBx and ÕtkulZxTUO0VûxHTúA ÉHx38ÉGá,122,4636,4636,4636,164,6269,6269,6269
